VDB - Chi nhánh NHPT Khu vực Minh Hải,7 An Dương Vương – P.7 - TP.Cà Mau - tỉnh Cà Mau
VDB - Chi nhánh NHPT Gia Lai,2A Hoàng Hoa Thám – TP.Pleiku - tỉnh Gia Lai
VDB - Chi nhánh NHPT Hà Giang,10 đường Bạch Đằng – TP.Hà Giang - tỉnh Hà Giang
VDB - Phòng giao dịch Hà Nam,3 đường Trần Phú – TP.Phủ Lý - tỉnh Hà Nam
VDB - Sở Giao dịch I,"Số 185A Giảng Võ, Quận Đống Đa, Thành phố Hà Nội"
VDB - Chi nhánh NHPT Hà Tĩnh,Xô Viết Nghệ Tĩnh – P.Nguyễn Du - TP.Hà Tĩnh - tỉnh Hà Tĩnh
VDB - Phòng giao dịch Hòa Bình,Đường Cù Chính Lan – TP. Hòa Bình – tỉnh Hòa Bình
VDB - Phòng giao dịch Hưng Yên,7 Chu Mạnh Trinh – TP.Hưng Yên - tỉnh Hưng Yên
VDB - Chi nhánh NHPT Khu vực Hải Dương - Hưng Yên,56 đường Hồng Quang – TP.Hải Dương - tỉnh Hải Dương
VDB - Chi nhánh NHPT Khu vực Khánh Hòa,65 Yersin – TP.Nha Trang - tỉnh Khánh Hoà
VDB - Chi nhánh NHPT Kiên Giang,80 Ngô Quyền – TP.Rạch Giá - tỉnh Kiên Giang
VDB - Chi nhánh NHPT Kon Tum,84B Phan Chu Trinh – TP.Kon Tum - tỉnh Kon Tum
VDB - Chi nhánh NHPT Lai Châu,Phường Quyết Thắng – TP.Lai Châu - tỉnh Lai Châu
VDB - Chi nhánh NHPT Lào Cai,182 đường Hoàng Liên – TP.Lào Cai - tỉnh Lào Cai
VDB - Chi nhánh NHPT Lâm Đồng,2A Lê Hồng Phong – TP.Đà Lạt - tỉnh Lâm Đồng
VDB - Chi nhánh NHPT Lạng Sơn,53 Lê Lợi – TP.Lạng Sơn - tỉnh Lạng Sơn
VDB - Chi nhánh NHPT Khu vực Nam Định - Hà Nam,151 đường Bắc Ninh – TP.Nam Định - tỉnh Nam Định
VDB - Chi nhánh NHPT Nghệ An,45 Duy Tân – P.Hưng Phúc – TP.Vinh - tỉnh Nghệ An
VDB - Chi nhánh NHPT Ninh Bình,Đường Lê Hồng Phong – TP.Ninh Bình - tỉnh Ninh Bình
VDB - Phòng giao dịch Ninh Thuận,28 đường 16/4 – TP.Phan Rang Tháp Chàm - tỉnh Ninh Thuận
VDB - Chi nhánh NHPT Phú Thọ,1500 Đại lộ Hùng Vương – P.Gia Cẩm – TP.Việt Trì - tỉnh Phú Thọ
VDB - Chi nhánh NHPT Phú Yên,337 đường Lê Duẩn – P.6 – TP.Tuy Hoà - tỉnh Phú Yên
VDB - Chi nhánh NHPT Quảng Bình,2 Trần Hưng Đạo – TP.Đồng Hới - tỉnh Quảng Bình
VDB - Phòng giao dịch Quảng Nam,13 Trần Hưng Đạo – TX.Tam Kỳ - tỉnh Quảng Nam
VDB - Chi nhánh NHPT Quảng Ninh,3 đường Đông Hồ - TP.Hạ Long - tỉnh Quảng Ninh
VDB - Phòng giao dịch Quảng Trị,184 đường Trần Hưng Đạo – TP.Đông Hà - tỉnh Quảng Trị
VDB - Chi nhánh NHPT Sóc Trăng,16A Trần Hưng Đạo – P.2 - TP.Sóc Trăng - tỉnh Sóc Trăng
VDB - Chi nhánh NHPT Sơn La,56B Lò Văn Giá – TP.Sơn La - tỉnh Sơn La
VDB - Chi nhánh NHPT Thanh Hoá,44A Đại lộ Lê Lợi – TP.Thanh Hoá - tỉnh Thanh Hoá
VDB - Chi nhánh NHPT Thái Bình,5 Đường Lê Lợi – TP.Thái Bình - tỉnh Thái Bình
VDB - Chi nhánh NHPT Khu vực Bắc Kạn - Thái Nguyên,16 Nha Trang – P. Trưng Vương – TP.Thái Nguyên – tỉnh Thái Nguyên
VDB - Chi nhánh NHPT Khu vực Thừa Thiên Huế - Quảng Trị,1 đường Hoàng Hoa Thám – TP.Huế
VDB - Phòng giao dịch Tiền Giang,19 đường Nam Kỳ Khởi Nghĩa – TP.Mỹ Tho - tỉnh Tiền Giang
VDB - Chi nhánh NHPT Khu vực Cần Thơ,01 Hai Bà Trưng – Q.Ninh Kiều – TP.Cần Thơ
VDB - Sở Giao dịch II,229 Đồng Khởi - Phường Bến Nghé - Quận 1 – TP.Hồ Chí Minh
VDB - Chi nhánh NHPT Hải Phòng,47A Lương Khánh Thiện - TP Hải Phòng
VDB - Chi nhánh NHPT Khu vực Quảng Nam - Đà Nẵng,74 đường Quang Trung – TP.Đà Nẵng
VDB - Phòng Giao dịch Trà Vinh,số 7A Trưng Nữ Vương Phường 1 TX. Trà Vinh Tỉnh Trà Vinh
VDB - Chi nhánh NHPT Tuyên Quang,Đường Tân Trào – TP.Tuyên Quang - tỉnh Tuyên Quang
VDB - Phòng giao dịch Tây Ninh,151A đường 30/4 – TP.Tây Ninh - tỉnh Tây Ninh
VDB - Phòng Giao dịch Vĩnh Long,"số 8 Hưng Đạo Vương, P.1, TP.Vĩnh Long"
VDB - Phòng giao dịch Vĩnh Phúc,10 Kim Ngọc – TP.Vĩnh Yên – tỉnh Vĩnh Phúc
VDB - Chi nhánh NHPT Yên Bái,1026 đường Điện Biên – TP.Yên Bái - tỉnh Yên Bái
VDB - Chi nhánh NHPT Điện Biên,Đường 7/5 - Mường Thanh - TP.Điện Biên Phủ - tỉnh Điện Biên
VDB - Chi nhánh NHPT khu vực Đăk Lăk - Đăk Nông,15 đường Trường Chinh – TP.Buôn Ma Thuột - tỉnh Đăk Lăk
VDB - Chi nhánh NHPT Đồng Nai,Đường Nguyễn Văn Trỗi – TP.Biên Hoà - tỉnh Đồng Nai
VDB - Phòng giao dịch Đồng Tháp,48 Nguyễn Quang Diệu – P.1 - TP.Cao Lãnh - tỉnh Đồng Tháp
VIB An Giang,"73-75 Nguyễn Trãi, Phường Mỹ Long, Tp. Long Xuyên, Tỉnh An Giang"
VIB Bà Rịa,"1264 - 1266 Bạch Đằng , P Phước Trung, TP Bà Rịa , Tỉnh Bà Rịa Vũng tàu"
VIB Nguyễn Hữu Cảnh,"Tầng trệt số 2 Nguyễn Hữu Cảnh, P.Thắng Nhất, TP Vũng Tàu"
VIB Vũng Tàu,"01K1 Nguyễn Thái Học, P7, TP Vũng tàu, Bà rịa - Vũng Tàu"
VIB Trần Hưng Đạo,"Số 56 Trần Hưng Đạo, TP. Vũng Tàu, Bà Rịa - Vũng Tàu"
VIB Thuận An,"Số 100 đường Nguyễn Văn Tiết, phường Lái Thiêu, thị xã Thuận An, tỉnh Bình Dương"
VIB Dĩ An,"Số 212, đường Nguyễn An Ninh, phường Dĩ An, thị xã Dĩ An, tỉnh Bình Dương"
VIB Bình Dương,"306 Đại lộ Bình Dương, Phường Phú Hòa, Thành Phố Thủ Dầu Một, Tỉnh Bình Dương"
VIB Thủ Dầu Một,"416 Cách Mạng Tháng 8, Phường Phú Cường, Thành phố Thủ Dầu Một, Bình Dương"
VIB Quy Nhơn,"104 Mai Xuân Thưởng, phường Lý Thường Kiệt, TP. Quy Nhơn, Bình Định"
VIB Cà Mau,"44 Lý Bôn, phường 2, Thành phố Cà Mau, tỉnh Cà Mau"
VIB Láng Hạ,"4A Láng Hạ, Quận Ba Đình, Hà Nội"
VIB Ba Đình,"273 Kim Mã, Phường Giảng Võ, Quận Ba Đình, Hà Nội"
VIB Đào Tấn,"38 phố Đào Tấn, Phường Cống Vị, Quận Ba Đình, Hà Nội"
VIB Liễu Giai,"Tầng 1 tòa nhà số 4 Liễu Giai,Cống Vị, Ba Đình, Hà Nội"
VIB Tây Hồ,"Tầng 1, tòa nhà N03-T1, Khu Ngoại giao đoàn Tây Hồ, Phường Xuân Tảo, Quận Bắc Từ Liêm, Hà Nội"
VIB Quan Hoa,"95 Cầu Giấy, Quận Cầu Giấy, Hà Nội"
VIB Cầu Giấy,"Tòa nhà CTM- 299 Cầu Giấy, Dịch Vọng, Hà Nội"
VIB Hoàng Quốc Việt,"số 2 Hoàng Quốc Việt, Quận Cầu Giấy, Hà Nội"
VIB Thăng Long,"Tầng 1, tầng 3 Tòa nhà Lâm Viên Complex, số 107 Nguyễn Phong Sắc, phường Dịch Vọng Hậu, quận Cầu Giấy, Hà Nội"
VIB Hai Bà Trưng,"Tòa nhà 59 Quang Trung, P. Nguyễn Du, Q. Hai Bà Trưng, Hà Nội"
VIB Lò Đúc,"số 106 Lò Đúc, phường Đống Mác, quận Hai Bà Trưng, TP Hà Nội"
VIB Chợ Mơ,"Tầng 1,2 Tòa nhà 331 Bạch Mai, P.Bạch Mai, Q. Hai Bà Trưng, Hà Nội"
VIB Minh Khai,"Tòa nhà Hàn Việt Tower, Số 203 Minh Khai, Phường Minh Khai, Quận Hai Bà Trưng, Hà Nội"
VIB Lý Thường Kiệt,"số 64-68 Lý Thường Kiệt, P.Trần Hưng Đạo, Q.Hoàn Kiếm, TP. Hà Nội"
VIB Lê Thánh Tông,"số 5 Lê Thánh Tông, P.Phan Chu Trinh, Q.Hoàn Kiếm, Hà Nội"
VIB Hoàn Kiếm,"33 Phố Huế, P. Hàng Bài, Q. Hoàn Kiếm, Hà Nội"
VIB Hồ Gươm,"Số 79 Hàng Trống, phường Hàng Trống, quận Hoàn Kiếm, Hà Nội"
VIB Hàng Bạc,"138 Hàng Bạc, Quận Hoàn Kiếm, Hà Nội"
VIB Trung tâm Kinh doanh,"Tầng 1, Tòa nhà Corner Stone, 16 Phan Chu Trinh, Phường Phan Chu Trinh, Quận Hoàn Kiếm, Hà Nội"
VIB Kim Đồng,"số 28A28B phố Kim Đồng, Phường Giáp Bát, Quận Hoàng Mai, Hà Nội"
VIB Hà Đông,"Tầng 1,2 - Tòa nhà Ellipse Tower, 110 Trần Phú, phường Mộ Lao, quận Hà Đông, Hà Nội"
VIB Xa La,"Biệt thự số 11, vị trí 02, khu dự án nhà ở Xa La, Phường Phúc La, Hà Đông, Hà Nội ( Xem bản đồ )"
VIB Văn Phú,"Số 655-657 đường Quang Trung, phường Phú La, Quận Hà Đông, TP. Hà Nội"
VIB Long Biên,"296 Nguyễn Văn Cừ, Phường Bồ Đề, quận Long Biên, Hà Nội"
VIB Mỹ Đình,"Số 124 - 224, ĐN7, CT5, Khu đô thị mới Mỹ Đình - Đường Phạm Hùng, Hà Nội"
VIB Nguyễn Cơ Thạch,"Tầng 1 nhà CT1A, Khu đô thị Mỹ Đình 1, Xã Mỹ Đình, Quận Nam Từ Liêm, Hà Nội"
VIB Trung Hòa,"Tầng 1, Tòa nhà 17T6, Khu Đô thị mới Trung Hòa-Nhân Chính, Phường Nhân Chính, Quận Thanh Xuân, Hà Nội"
VIB Thanh Xuân,"158 Lê Trọng Tấn, P.Khương Mai, Q.Thanh Xuân, Hà Nội"
VIB Lê Văn Lương,"Một phần diện tích tầng 1, tầng 2 tòa nhà The Golden Palm, số 21 Lê Văn Lương, Phường Nhân Chính, Quận Thanh Xuân, Hà Nội"
VIB Thạch Thất,"Cụm công nghiệp Bình Phú, đường 419, xã Bình Phú, huyện Thạch Thất, Hà Nội"
VIB Thụy Khuê,"số 20 đường Thụy Khuê, phường Thụy Khuê, quận Tây Hồ, hà Nội"
VIB Hà Nội,"Số 306 Tây Sơn, Phường Ngã Tư Sở, Quận Đống Đa, Hà Nội"
VIB Đống Đa,"Tầng 1,3 tòa nhà The CONINCO, số 4 Tôn Thất Tùng, phường Trung Tự, quận Đống Đa, Hà Nội"
VIB Hào Nam,"Tầng 1, tầng 2 tòa nhà NHS Center, số 214 Hào Nam, Phường Cát Linh, Quận Đống Đa, Hà Nội"
VIB Hà Nội,"Số 306 Tây Sơn, Phường Ngã Tư Sở, Quận Đống Đa, Hà Nội"
VIB Sở Giao Dịch,"Tầng 1, 6, 7 Tòa nhà Corner Stone, 16 Phan Chu Trinh, Phường Phan Chu Trinh, Quận Hoàn Kiếm, Hà Nội"
VIB Xã Đàn,"Số 255 Xã Đàn, phường Nam Đồng, Quận Đống Đa, TP Hà Nội"
VIB Vân Đình,"Tầng 1, tầng 2, tầng 3 căn nhà số 130 Thanh Ấm, thị trấn Vân Đình, huyện Ứng Hòa, Hà Nội"
VIB Thành Đông,"Số 61 Thống Nhất, phường Lê Thanh Nghị, thành phố Hải Dương, tỉnh Hải Dương"
VIB Hải Dương,"Số 36 phố Nguyễn Lương Bằng, phường Bình Hàn, TP Hải Dương, Tỉnh Hải Dương"
VIB Phả Lại,"Cổng Phả Lại 1, Phường Phả Lại, thị xã Chí Linh, tỉnh Hải Dương"
VIB Sao Đỏ,"Số 119 đường Nguyễn Trãi, phường Sao Đỏ, thị xã Chí Linh, tỉnh Hải Dương"
VIB Phan Chu Trinh,"21 Phan Chu Trinh, P. Xương Huân, TP Nha Trang, Tỉnh Khánh Hòa"
VIB Nha Trang,"50 Lê Thành Phương, P. Phương Sài, TP Nha Trang, Tỉnh Khánh Hòa"
VIB Rạch Giá,"Số 333 đường Nguyễn Trung Trực, phường Vĩnh Lạc, thành phố Rạch Giá, tỉnh Kiên Giang"
VIB Rạch Sỏi,"Lô L5, căn số 22-23, khu dân cư TTTM Rạch Sỏi, đường Mai Thị Hồng Hạnh, phường Rạch Sỏi, thành phố Rạch Giá, tỉnh Kiên Giang"
VIB Kiên Giang,243 Trần Phú - Phường Vĩnh Thạnh - TP. Rạch Giá - Tỉnh Kiên Giang
VIB Lâm Đồng,"56-58 Khu Hòa Bình, Phường 1, TP Đà Lạt, Tỉnh Lâm Đồng"
VIB Diễn Châu,"Tầng 1, Tòa nhà Trụ sở Bưu điện Huyện Diễn Châu, Khối 4, Thị trấn Diễn Châu, Huyện Diễn Châu, tỉnh Nghệ An"
VIB Vinh,"Tầng 1 nhà B Khu Trung Tâm Thương Mại-Dịch vụ, đường Quang Trung, P. Quang Trung, TP Vinh, tỉnh Nghệ An"
VIB Hưng Dũng,"Một phần tầng 1, tòa nhà Trung Đô Tower, đại lộ Lênin, khối Trưng Đô, phường Hưng Dũng, thành phố Vinh, tỉnh Nghệ An"
VIB Chợ Vinh,"108 Lê Huân, Khối 3, P.Hồng Sơn, TP Vinh, tỉnh Nghệ An"
VIB Hưng Bình,"Số 03 đường Mai Hắc Đế, phường Quán Bàu, Thành phố Vinh, tỉnh Nghệ An"
VIB Việt Trì,"số 1676 đại lộ Hùng Vương, phường Nông Trang, Thành phố Việt trì, tỉnh Phú Thọ."
VIB Quảng Ngãi,"Số 289 đường Quang Trung, phường Trần Hưng Đạo, thành phố Quảng Ngãi, tỉnh Quảng Ngãi"
VIB Hoàng Thạch,"Số 100 đường Hoàng Hoa Thám, thị trấn Mạo Khê, huyện Đông Triều, tỉnh Quảng Ninh"
VIB Quảng Ninh,"88 Lê Thánh Tông, P.Hồng Gai, TP Hạ Long, Quảng Ninh"
VIB Bãi Cháy,"26-28 Tổ 1, Khu 9, đường Hạ Long, phường Bãi Cháy, Tp Hạ Long, tỉnh Quảng Ninh"
VIB Hạ Long,"Tổ 8, Khu 8, phường Hồng Hải, thành phố Hạ Long, tỉnh Quảng Ninh"
VIB Cẩm Phả,"435 đường Trần Phú, Phường Cẩm Trung, TP Cẩm Phả, Tỉnh Quảng Ninh"
VIB Cửa Ông,"Tổ 72 phường Cửa Ông, thị xã Cẩm Phả, tỉnh Quảng Ninh"
VIB Uông Bí,"496 đường Quang Trung (TTTM),P.Quang Trung, TX Uông Bí, tỉnh Quảng Ninh"
VIB Lam Sơn,"Số 217 đường Quang Trung 1, phường Đông Vệ, Thành phố Thanh Hóa, tỉnh Thanh Hóa"
VIB Thanh Hóa,"Số 2 đường Lê Hữu Lập, phường Lam Sơn, thành phố Thanh Hóa, tỉnh Thanh Hóa"
VIB Bà Triệu,"Lô 30, Khu nhà liền kề, Phường Đông Thọ, đường Bà Triệu, TP. Thanh Hóa, Thanh Hóa"
VIB Trường Thi,"Số 267 đường Trường Thi, phường Điện Biên, thành phố Thanh Hóa, tỉnh Thanh Hóa"
VIB Lê Quý Đôn,"Số 170C đường Lê Quý Đôn, phường Bồ Xuyên, thành phố Thái Bình, tỉnh Thái Bình"
VIB Thái Bình,"Tầng 1 tòa nhà Thái Bình Dream, số 355 Lý Bôn, phường Đề Thám, Tp Thái Bình, tỉnh Thái Bình."
VIB Thái Nguyên,"Số 661đường Lương Ngọc Quyến, phường Phan Đình Phùng, Thành phố Thái Nguyên, tỉnh Thái Nguyên"
VIB Gang Thép,"Tổ 11 Phường Trung Thành, Thành phố Thái Nguyên, Tỉnh Thái Nguyên"
VIB Lương Ngọc Quyến,"127 Lương Ngọc Quyến, phường Hoàng Văn Thụ, thành phố Thái Nguyên, tỉnh Thái Nguyên"
VIB Huế,"Số 2 Lý Thường Kiệt, phường Vĩnh Ninh, thành phố Huế, tỉnh Thừa Thiên Huế"
VIB Trường Tiền,"30 đường Lê Lợi, phường Phú Nhuận, TP.Huế"
VIB Đông Ba,"Số 59 Mai Thúc Loan, P.Thuận Thành, Thành phố Huế, Tỉnh TT Huế"
VIB Hưng Lợi,"Số 220 đường 3/2, phường Hưng Lợi, quận Ninh Kiều, thành phố Cần Thơ"
VIB Cái Khế,"19-21 Trần Văn Khéo, Ninh Kiều, Cần Thơ"
VIB Ninh Kiều,"84/3 Mậu Thân, An Hòa, Ninh Kiều, TP Cần Thơ"
VIB Cần Thơ,"Tầng 1, 2 tòa nhà VCCI, số 12 Hòa Bình, phường An Cư, quận Ninh Kiều, thành phố Cần Thơ"
VIB Đinh Tiên Hoàng,"126-128 Đinh Tiên Hoàng, Phường 1, Quận Bình Thạnh, TP HCM"
VIB Văn Thánh,"H10A, Đường D2 - Phường 25 - Quận Bình Thạnh - TP.HCM"
VIB Thanh Đa,"667 Xô Viết Nghệ Tĩnh, Phường 26, Quận Bình Thạnh, TP HCM"
VIB Bình Thạnh,137 Lê Quang Định - Phường 14 - Quận Bình Thạnh - TP.HCM
VIB Gò Vấp,"366A2 Phan Văn Trị, Phường 5, Quận Gò Vấp, TP.HCM"
VIB Quang Trung,"37 Quang Trung, Phường 3, Quận Gò Vấp, TP HCM"
VIB Lê Đức Thọ,"10/192B Lê Đức Thọ, P15, Q.Gò Vấp, TP HCM"
VIB Thành Đô,"Số 128B Phan Đăng lưu, phường 3, Phú Nhuận,Hồ Chí Minh"
VIB Quận 1,"Số 87A Hàm Nghi, phường Nguyễn Thái Bình,Q.1, TP HCM"
VIB Huỳnh Thúc Kháng,"Số 35-37 Huỳnh Thúc Kháng, phường Bến Nghé, quận 1, thành phố Hồ Chí Minh"
VIB Sài Gòn,"Một phần tầng trệt, Phòng 203-04 tầng 2 và Phòng 301 tầng 3, Tòa nhà Mê Linh Point, số 2 đường Ngô Đức Kế, phường Bến Nghé, quận 1, thành phố Hồ Chí Minh"
VIB HCM,Tòa nhà SailingTower - 111A Pasteur - Phường Bến Nghé - Quận 1 - TP.HCM
VIB Tân Định,"Số 300 Hai Bà Trưng, Phường Tân Định, Quận 1, thành phố Hồ Chí Minh"
VIB Thành Nam,"Số 246 Cống Quỳnh, Phường Phạm Ngũ Lão, Quận 1, TP HCM"
VIB Phạm Ngũ Lão,Số 343 đường Phạm Ngũ Lão - Phường Phạm Ngũ Lão - Quận 1 - TP.HCM
VIB Tôn Đức Thắng,"4B Tôn Đức Thắng, Quận 1, TP HCM"
VIB 3 tháng 2,"Số 554-556-558 đường 3 tháng 2, phường 14, quận 10, thành phố HCM"
VIB Thống Nhất,"1174 đường 3 tháng 2 , Phường 8, Quận 11, TP HCM"
VIB Lê Đại Hành,"Số 457 - 457B Lê Đại Hành, phường 11, quận 11, thành phố HCM"
VIB Hùng Vương,"468 đường Hồng Bàng, P.16, Q.11, TP HCM"
VIB Quận 11,Số 440-442 Lạc Long Quân - Phường 5 - Quận 11 - TP.HCM
VIB Quận 2,Số 1A Trần Não - Phường Bình An - Quận 2 - TP.HCM
VIB Cát Lái,Số 300 Nguyễn Thị Định - PhườngThạnh Mỹ Lợi - Quận 2 - TP.HCM
VIB Tao Đàn,"Số 28 đường Cách Mạng Tháng Tám, phường 6, quận 3, TP Hồ Chí Minh"
VIB Gia Định,"Số 134 đường Cao Thắng, phường 4, quận 3, TP Hồ Chí Minh"
VIB Nhiêu Lộc,"Tầng trệt, TTTM DV thuộc Tòa cao ốc SCREC, Phường 12, Quận 3, TP HCM"
VIB Quận 4,"188-190 Khánh Hội, phường 5, quận 4, TPHCM"
VIB - Châu Văn Liêm,"9 Châu Văn Liêm, Phường 14, Quận 5, TP HCM"
VIB Nguyễn Trãi,"68 Nguyễn Trãi, Quận 5, TP HCM"
VIB Quận 5,"133 Nguyễn Chí Thanh, Phường 9, Quận 5, TP HCM"
VIB Chợ Lớn,"47 Lê Tấn Kế , phường 2, quận 6, Hồ Chí Minh"
VIB Quận 6,"Số 161 Kinh Dương Vương, Phường 12, Quận 6, TP HCM"
VIB Nguyễn Thị Thập,"Số 5-7 Nguyễn Thị Thập, Khu Dân Cư Him Lam, Phường Tân Hưng, Quận 7, thành phố Hồ Chí Minh"
VIB Hoàng Văn Thái,"Tòa nhà IMV, 87 Hoàng Văn Thái,Phú Mỹ Hưng, Phường Tân Phú, Quận 7, TP HCM"
VIB Phú Mỹ Hưng,"Nhà số 5, Khu phố Mỹ Hoàng, Đại lộ Nguyễn Văn Linh, Phường Tân Phong, Quận 7, TP HCM"
VIB Quận 9,"Số 116-118 Đỗ Xuân Hợp, khu phố 2, phường Phước Long A, quận 9, thành phố HCM"
VIB Thủ Đức,"192 Võ Văn Ngân, Phường Bình Thọ, Quận Thủ Đức, TP.HCM"
VIB Bàu Cát,"Số 64-66 Bàu Cát, Phường 14, Quận Tân Bình, TP HCM"
VIB Lê Văn Sỹ,"tầng trệt và tầng lửng Tòa nhà CONABUILDING, số 302 Lê Văn Sỹ, phường 1, quận Tân Bình, TP. HCM"
VIB Tân Bình,"415B Hoàng Văn Thụ, Phường 2, Quận Tân Bình, TP HCM"
VIB Cộng Hòa,"Số 420-422 Cọng Hòa, Phường 13, Quận Tân Bình, TP.HCM"
VIB Trường Sơn,"Số 2, đường Trường Sơn, quận Tân Bình, Tp Hồ Chí Minh"
VIB Phú Nhuận,307/5 Nguyễn Văn Trỗi - Phương 1 - Quận Tân Bình - TP.HCM
VIB Tân Phú,"139 Đường Hoà Bình, Phường Hiệp Tân, Quận Tân Phú, TP HCM"
VIB Tân Thành,"Số 913 Lũy Bán Bích, Phường Tân Thành, Quận Tân Phú, TP HCM"
VIB Âu Cơ,"Sô 907 Âu Cơ, Phường Sân Sơn Nhì, QuậnTân Phú, TP HCM"
VIB Thủy Nguyên,"Số 9 đường Bạch Đằng, thị trấn Núi Đèo, huyện Thủy Nguyên, Hải Phòng"
VIB Hải An,"Số 523- 525 Ngô Gia Tự, phường Đằng Lâm, quận Hải An, TP. Hải Phòng"
VIB Hải Phòng,"Số 09, Trần Hưng Đạo, Hồng Bàng, Hải Phòng"
VIB Bạch Đằng,"Số 199 Bạch Đằng, Phường Thượng Lý, Quận Hồng Bàng, Thành phố Hải Phòng"
VIB Lê Chân,"Số 134 phố Tô Hiệu, phường Trại Cau, quận Lê Chân, TP Hải Phòng"
VIB Hồng Bàng,"113 Trần Nguyên Hãn, Phường Trần Nguyên Hãn, Quận Lê Chân, TP Hải Phòng"
VIB Lạch Tray,"Số 114 đường Lạch Tray, phường Lạch Tray, quận Ngô Quyền, thành phố Hải Phòng"
VIB Ngô Quyền,"283 - 285 đường Đà Nẵng, phường Cầu Tre, Quận Ngô Quyền, TP. Hải Phòng"
VIB Hải Châu,"Số 211 đường Hùng Vương, Phường Hải Châu II, Quận Hải Châu, TP. Đà Nẵng"
VIB Đà Nẵng,"208-210-212 Nguyễn Văn Linh, P.Thạc Gián, Q.Thanh Khê.TP Đà Nẵng"
VIB Sông Hàn,"Số 217-219 đường Lê Duẩn, phường Tân Chính, quận Thanh Khê, thành phố Đà Nẵng"
VIB Tây Ninh,"324 Đường 30/4, KP1, P3, TP.Tây Ninh, Tây Ninh"
VIB Phúc Yên,"Số 99 và số 101, đường Trần Hưng Đạo, phường Trưng Trắc, thị xã Phúc Yên, tỉnh Vĩnh Phúc"
VIB Vĩnh Phúc,"Số 69 đường Mê Linh, phường Liên Bảo, TP Vĩnh Yên, Tỉnh Vĩnh Phúc"
VIB Vĩnh Yên,"Tầng 1 Siêu thị Sài Gòn - Vĩnh Yên, khu đô thị chùa Hà Tiên - Liên Bảo, TP Vĩnh Yên, tỉnh Vĩnh Phúc"
VIB Buôn Ma Thuột,Số 39- 41 Đường Quang Trung - Phường Thống Nhất - TP. Buôn Ma Thuột - Tỉnh ĐakLak
VIB Thành Công,"Số 389 Phan Chu Trinh, Phường Tân Lợi, thành phố Buôn Ma Thuột, Tỉnh Daklak"
VIB ĐăkLăk,"Số 27 Nguyễn Tất Thành, Phường Tân Lợi, TP.Buôn Ma Thuột, Tỉnh Daklak"
VIB Trảng Bom,"Khu hành chính 30/4 TT Tràng Bom - Huyện Trảng Bom, Tỉnh Đồng Nai"
VIB Đồng Nai,"Số 214 Hà Huy Giáp, Thành phố Biên Hòa, tỉnh Đồng Nai"
VIB Tân Mai,"97/481B,KP4, đường Phạm Văn Thuận, TP Biên Hòa, Đồng Nai"
VIB Hố Nai,"97/5, QL1, KP9, P.Tân Biên, Biên Hòa, Đồng Nai"
VIB Long Khánh,"175 Hùng Vương, KP 3, P.Xuân Hòa, Thị Xã Long Khánh, Tỉnh Đồng Nai"
VIB Đồng Tháp,"82-84 Nguyễn Huệ, Phường 2, TP Cao Lãnh, Đồng Tháp"
VIB Sa Đéc,"A24 - A26 ,Đường Hùng Vương, TP Sa Đéc , Đồng Tháp"
Viet Capital Bank - PGD Phú Tân,"248 Tôn Đức Thắng, Ấp Trung 1, Thị trấn Phú Mỹ, Huyện Phú Tân, Tỉnh An Giang"
Viet Capital Bank - PGD Thoại Sơn,"Số 350, Đường Nguyễn Huệ, Ấp Bắc Sơn, Thị trấn Núi Sập, Huyện Núi Thoại Sơn, tỉnh An Giang"
Viet Capital Bank - CN An Giang,"1219 Trần Hưng Đạo, P. Mỹ Bình, TP. Long Xuyên, Tỉnh An Giang"
Viet Capital Bank - PGD Châu Đức,"Số 324, Lê Hồng Phong, Thị trấn Ngãi Giao, Huyện Châu Đức, Tỉnh Bà Rịa - Vũng Tàu"
Viet Capital Bank - CN Vũng Tàu,"20G2 Nguyễn Thái Học, P.7, TP. Vũng Tàu"
Viet Capital Bank - PGD Tân Uyên,"Đường ĐT 747B, khu phố 7, Phường Uyên Hưng, Thị xã Tân Uyên, Tỉnh Bình Dương"
Viet Capital Bank - PGD Dĩ An,"86 Nguyễn An Ninh, Khu phố Nhị Đồng 2, Phường Dĩ An, Tx Dĩ An, Tỉnh Bình Dương"
Viet Capital Bank - PGD Sở Sao,"1491 Khu phố 4, Phường Hiệp An, TX Thủ Dầu Một, Tỉnh Bình Dương"
Viet Capital Bank - CN Bình Dương,"316 Đại Lộ Bình Dương, Phường Phú Hòa, TP Thủ Dầu Một, Bình Dương"
Viet Capital Bank - CN Phan Thiết,"252 Tôn Đức Thắng, P. Phú Thủy, Tp. Phan Thiết, Tỉnh Bình Thuận"
Viet Capital Bank - Chi nhánh Bắc Ninh,"Số 10, đường Nguyễn Đăng Đạo, P. Tiền An, TP. Bắc Ninh, Tỉnh Bắc Ninh"
Viet Capital Bank - PGD Đầm Dơi,"Số 105, Đường 19/5, Khóm 4, Thị trấn Đầm Dơi, Huyện Đầm Dơi, Tỉnh Cà Mau"
Viet Capital Bank - CN Cà Mau,"Số 66A, Trần Hưng Đạo, Phường 5, TP. Cà Mau"
Viet Capital Bank - CN Gia Lai,"69A-71A-71 Đinh Tiên Hoàng, Phường Diên Hồng, TP.Pleiku, Tỉnh Gia Lai"
Viet Capital Bank - PGD Ba Đình,"16 Giang Văn Minh, P. Kim Mã, Q. Ba Đình, TP. Hà Nội"
Viet Capital Bank - CN Thăng Long,"375 - 377 Hoàng Quốc Việt, P. Nghĩa Tân, Q. Cầu giấy, Hà Nội"
Viet Capital Bank - PGD Cầu Giấy,"Số 9 Lô 2B Khu đô thị Trung Yên, P. Yên Hòa, Q. Cầu Giấy, TP. Hà Nội"
Viet Capital Bank - PGD Hai Bà Trưng,"382 - 384 Trần Khát Chân, phường Thanh Nhàn, quận Hai Bà Trưng, TP. Hà Nội"
Viet Capital Bank - PGD Hoàn Kiếm,"69 Phố Trần Xuân Soạn, Phường Ngô Thì Nhậm, Quận Hai Bà Trưng, TP.Hà Nội"
Viet Capital Bank - CN Hà Nội,"109 Xã Đàn, Phường Phương Liên, Quận Đống Đa, Hà Nộ"
Viet Capital Bank - PGD Ðống Ða,"Số 20 Võ Văn Dũng, Phường Ô Chợ Dừa, Quận Đống Đa, Tp. Hà Nội"
Viet Capital Bank - CN Nha Trang,"14 Ngô Gia Tự, P.Phước Tiến, TP.Nha Trang, Khánh Hòa"
Viet Capital Bank - CN Kiên Giang,"169 Trần Phú, P. Vĩnh Thanh, Tp. Rạch Giá, Tỉnh Kiên Giang"
Viet Capital Bank - CN Long An,"16 Trà Quý Bình, Phường 2, TP. Tân An, Tỉnh Long An"
Viet Capital Bank - PGD Kiến Tường,"Số 1 Trần Hưng Đạo, KP.1, Phường 1, TX. Kiến Tường, Tỉnh Long An"
Viet Capital Bank - CN Quảng Ninh,"Số 20, Đường Trần Hưng Đạo, Phường Trần Hưng Đạo, Thành Phố Hạ Long, Tỉnh Quảng Ninh"
Viet Capital Bank - CN Sóc Trăng,"Số 30A, Trần Hưng Đạo, Phường 2, Tp. Sóc Trăng, Tỉnh Sóc Trăng"
Viet Capital Bank - CN Tiền Giang,"Số 143, Nam Kỳ Khởi Nghĩa, Phường 4, TP. Mỹ Tho, Tỉnh Tiền Giang"
Viet Capital Bank - PGD Gò Công,"Số 19 Nguyễn Huệ, Khu phố 1, Phường 1, Thị xã Gò Công, Tỉnh Tiền Giang"
Viet Capital Bank - PGD Thới Lai,"Ấp Thới Thuận A, Thị trấn Thới Lai, Huyện Thới Lai, Tp. Cần Thơ"
Viet Capital Bank - PGD Ninh Kiều,"307 Nguyễn Văn Cừ, P.An Hòa, Q.Ninh Kiều, TP.Cần Thơ"
Viet Capital Bank - CN Cần Thơ,"135H - 135Y Trần Hưng Đạo, P. An Phú, Q. Ninh Kiều, TP. Cần Thơ"
Viet Capital Bank - PGD Hàng Xanh,"306 Bạch Đằng, phường 14, quận Bình Thạnh, Tp.HCM"
Viet Capital Bank - PGD Quang Trung,"Số 1339 -1341 Phan Văn Trị, phường 10, quận Gò Vấp, Tp. HCM"
Viet Capital Bank - PGD Phú Nhuận,"172A Phan Đăng Lưu, Phường 3, Quận Phú Nhuận, TP.HCM"
Viet Capital Bank - PGD Nguyễn Trãi,"208 Nguyễn Trãi, P. Phạm Ngũ Lão, Quận 1, TP HCM"
Viet Capital Bank - PGD Quận 10,"211 Tô Hiến Thành, P.13, Quận 10, TPHCM"
Viet Capital Bank - PGD Lạc Long Quân,"395-397 Lạc Long Quân, Phường 5, Quận 11, Tp.HCM"
Viet Capital Bank - CN Đông Sài Gòn,"37 Trần Não, Phường Bình An, Quận 2, TP.HCM"
Viet Capital Bank - Hội Sở,"412 NGUYỄN THỊ MINH KHAI, PHƯỜNG 5, QUẬN 3, TP. HCM"
Viet Capital Bank - CN Nam Sài Gòn,"867 - 869 Trần Hưng Đạo, Phường 1, Quận 5, TP.HCM"
