Agribank - Chi nhánh Huyện An Dương,"Thị trấn An Dương, huyện An Dương, thành phố Hải Phòng"
Agribank - Chi nhánh NHNo&PTNT An Hưng,"Km 14- Quốc lộ 5, huyện An Dương, thành phố Hải Phòng"
Agribank - Phòng giao dịch Trường Sơn,"Xã TRường Sơn, huyện An Lão, thành phố Hải Phòng"
Agribank - Phòng giao dịch Mỹ Đức,"Xã Mỹ Đức, huyện An Lão,, thành phố Hải Phòng"
Agribank - Chi nhánh huyện An Lão,"Thị trấn An Lão, huyện An Lão, thành phố Hải Phòng"
Agribank - Phòng giao dịch Thị trấn Cát Bà,"Thị trấn Cát Bà, huyện Cát Hải, thành phố Hải Phòng"
Agribank - Chi nhánh NHNo&PTNT Khu vực Cát Hải,"Thị trấn Cát Hải, huyện Cát Hải, thành phố Hải Phòng"
Agribank - Chi nhánh NHNo&PTNT Khu vực Cát Bà,"Thị trấn Cát Bà, huyện Cát Hải, thành phố Hải Phòng"
Agribank - Phòng giao dịch thị trấn Đối,"Thị trấn Đối, huyện Kiến Thuỵ, thành phố Hải Phòng"
Agribank - Chi nhánh huyện Kiến Thụy,"SỐ 4 - Cẩm Xuân- Thị trấn Núi ĐỐi, huyện Kiến Thuỵ, thành phố Hải Phòng"
Agribank - Chi nhánh NHNo&PTNT Đại Hợp,"Xã Đại Hợp, huyện Kiến Thuỵ, thành phố Hải Phòng"
Agribank - Chi nhánh NHNo&PTNT Thanh Lãng,"Xã Kỳ Sơn- Huyện Thuỷ NguYên, thành phố Hải Phòng"
Agribank - Chi nhánh NHNo&PTNT Ngũ Lão,"Xã Ngũ Lão- Huyện Thuỷ NguYên, thành phố Hải Phòng"
Agribank - Chi nhánh NHNo&PTNT Huyện Thuỷ Nguyên,"Thị trấn Núi Đèo, huyện Thuỷ NguYên,, thành phố Hải Phòng"
Agribank - Phòng giao dịch Đông Quy,"Xã Toàn Thắng, huyện Tiên Lãng , thành phố Hải Phòng"
Agribank - Phòng giao dịch Cầu Đầm,"Xã Đoàn Lập, huyện Tiên Lãng, thành phố Hải Phòng"
Agribank - Chi nhánh NHNo&PTNT Vàng Lãng,"Xã Hùng Thắng, huyện Tiên Lãng,, thành phố Hải Phòng"
Agribank - Chi nhánh NHNo&PTNT Huyện Tiên Lãng,"Thị trấn Tiên Lãng- Huyện Tiên Lãng, thành phố Hải Phòng"
Agribank - Phòng giao dịch Cộng Hiền,"Xã Cộng Hiền, huyện VĨnh Bảo, thành phố Hải Phòng"
Agribank - Phòng giao dịch An Cầu,"Thị trấn Vĩnh Bảo, huyện Vĩnh Bảo, thành phố Hải Phòng"
Agribank - Chi nhánh NHNo&PTNT Nam Am,"Xã Tam Cường, huyện VĨnh Bảo, thành phố Hải Phòng"
Agribank - Chi nhánh huyện Vĩnh Bảo,"Số 19 đường 20/8- Thị trấn Vĩnh Bảo, thành phố Hải Phòng"
Agribank - Phòng giao dịch NGô Gia Tự,"Số 5 Ngô Gia Tự- Quận Hải An, thành phố Hải Phòng"
Agribank - Chi nhánh NHNo&PTNT Quận Hải An,"Ngã 4 đường Ngô Gia Tự và đường Lê Hồng Phong, thành phố Hải Phòng"
Agribank - Phòng giao dịch Trần Quang KHải,"Số 88 D Trần Quang KHải- Quận Hồng Bàng,, thành phố Hải Phòng"
Agribank - Phòng giao dịch Thượng Lý,"Số 2 Đường Hà Nội, Phường Thượng Lý, Quận Hồng Bàng, Thành phố Hải Phòng"
Agribank - Phòng giao dịch Quán Toan,"Phường Quán Toan- Quận Hồng bàng, thành phố Hải Phòng"
Agribank - Chi nhánh NHNo&PTNT Quận Hồng Bàng,"Số 72 Điện Biên Phủ- Quận Hồng Bàng,, thành phố Hải Phòng"
Agribank - Phòng giao dịch Quán Trữ,"Phường Quán Trữ- Quận Kiến An,, thành phố Hải Phòng"
Agribank - Chi nhánh NHNo&PTNT Quận Kiến An,"95 Trần Thành Ngọ- Quận Kiến An,, thành phố Hải Phòng"
Agribank - PGD Trần Nguyên Hãn,"217 Trần NguYên Hãn- Quận Lê Chân,, thành phố Hải Phòng"
Agribank - Chi nhánh NHNo&PTNT Quận Lê Chân,"393 Tô Hiệu,Quận Lê Chân,, thành phố Hải Phòng"
Agribank - Phòng giao dịch Lương Khánh Thiện,"83 Lương Khánh Thiện- Quận NGô Quyền, thành phố Hải Phòng"
Agribank - Phòng giao dịch Cầu Đất,"109, Đường cầu đất, Ngô Quyền, thành phố Hải Phòng"
Agribank - Chi nhánh NHNo&PTNT Trần Phú,"25 Đường Trần Phú- Quận NGô Quyền, thành phố Hải Phòng"
Agribank - Chi nhánh NHNo&PTNT Quân Ngô Quyền,"276 A- Đà Nẵng- Quận Ngô Quyền, thành phố Hải Phòng"
Agribank - Chi Nhánh NHNo & PTNT Thành phố Hải Phòng,"283 Lạch Tray- Quận Ngô Quyền, thành phố Hải Phòng"
Agribank - Phòng giao dịch Ngọc Xuyên,"353 phường Ngọc Xuyên, quận Đồ Sơn, TP Hải Phòng"
Agribank - Chi nhánh NHNo&PTNT Thị xã Đồ Sơn,"8 Lý Thánh Tông-Thị xã Đồ Sơn, thành phố Hải Phòng"
Agribank - Phòng giao dịch Khuê Trung,"138 Cách mạng tháng tám, thành phố Đà Nẵng"
Agribank - Phòng giao dịch Hoà Phát,"57 Lê Trọng Tấn, thành phố Đà Nẵng"
Agribank - Phòng giao dịch An Hòa,"03 Kiốt, Chợ Cẩm Lệ, phường Khuê Trung, thành phố Đà Nẵng"
Agribank - Chi nhánh NHNo&PTNT Quận Cẩm Lệ,"349 Cách mạng tháng tám, thành phố Đà Nẵng"
Agribank - Phòng giao dịch Hoà Sơn,"Hoà Sơn, huyện Hoà Vang, thành phố Đà Nẵng"
Agribank - Phòng giao dịch Hòa Phước,"Quốc lộ 1A Miếu Bông, huyện Hoà Vang, thành phố Đà Nẵng"
Agribank - Chi nhánh NHNo&PTNT Huyện Hoà Vang,"Hoà Nhơn, huyện Hoà Vang, thành phố Đà Nẵng"
Agribank - Phòng giao dịch số 3,"162 Lê Đình Lý, thành phố Đà Nẵng"
Agribank - Phòng giao dịch số 2,"33 Nguyễn Thái Học, thành phố Đà Nẵng"
Agribank - Phòng giao dịch số 1,"23 Phan Đình Phùng, thành phố Đà Nẵng"
Agribank - Phòng giao dịch Sân bay Đà Nẵng,"Sân Bay Đà Nẵng, thành phố Đà Nẵng"
Agribank - Phòng giao dịch Nguyễn Tri Phương,"Lô A1 số 77 Đường Nguyễn Tri Phương, Phường Hoà Thuận Tây, Quận Hải Châu, TP Đà Nẵng"
Agribank - Phòng giao dịch Hòa Cương,"392 Núi Thành, thành phố Đà Nẵng"
Agribank - Phòng giao dịch 2/9,"228 đường 2/9 quận Hải Châu, TP Đà Nẵng"
Agribank - Chi nhánh NHNo&PTNT Tân Chính,"336 Lê Duẩn, thành phố Đà Nẵng"
Agribank - Chi nhánh NHNo&PTNT Đống Đa,"243 Đống đa, thành phố Đà Nẵng"
Agribank - Chi nhánh NHNo&PTNT Chợ Mới,"280 Trưng Nữ Vương, thành phố Đà Nẵng"
Agribank - Chi nhánh NHNo&PTNT Chi Lăng,"188 Hùng Vương, thành phố Đà Nẵng"
Agribank - Chi nhánh NHNo&PTNT Hải Châu,"107 Phân Châu Trinh, quận Hải Châu, thành phố Đà Nẵng"
Agribank - Chi Nhánh NHNo & PTNT Thành phố Đà Nẵng,"23 Phan Đình Phùng, thành phố Đà Nẵng"
Agribank - Chi nhánh NHNo&PTNT Khu công nghiệp Đà Nẵng,"Khu công nghiệp Đà Nẵng, thành phố Đà Nẵng"
Agribank - Phòng giao dịch Hoà Minh,"135, Tôn Đức Thắng, Thành phố Đà nẵng"
Agribank - Phòng giao dịch Hoà Khánh,"65, Nguyễn Cảnh Trân, thành phố Đà Nẵng"
Agribank - Phòng giao dịch Hoà Hiệp,"17 đường Nguyễn Văn Cừ, phường Hoà Hiệp Bắc, quận Liên Chiểu, Tp Đà Nẵng"
Agribank - Chi nhánh NHNo&PTNT Quận Liên Chiểu,"136 Nguyễn Lương Bằng, quận Liên Chiểu, thành phố Đà nẵng"
Agribank - Chi nhánh NHNo&PTNT Khu công nghiệp Hoà Khánh,"Khu công nghiệp Hoà Khánh, thành phố Đà Nẵng"
Agribank - Phòng giao dịch Non Nước,"103, Huyền Trần Công Chúa, thành phố Đà Nẵng"
Agribank - Phòng giao dịch Bắc Mỹ An,"364 Ngũ Hành Sơn, Thành phố Đà Nẵng"
Agribank - Chi nhánh NHNo&PTNT Quận Ngũ Hành Sơn,"470 A Lê Văn Hiến, quận Ngũ hành Sơn, thành phố Đà Nẵng"
Agribank - Phòng giao dịch Thọ Quang,"35 Trần Quang KHải, thành phố Đà Nẵng"
Agribank - Phòng giao dịch An Hải Đông,"65 Ngô Quyền, phường An Hải Đông, quận Sơn Trà, tp Đà Nẵng"
Agribank - Chi nhánh NHNo&PTNT Quận Sơn Trà,"625 Ngô quyền, quận Sơn Trà, thành phố Đà Nẵng"
Agribank - Phòng giao dịch Thanh Lộc Đán,"88 Dũng Sĩ Thanh Khê, thành phố Đà Nẵng"
Agribank - Phòng giao dịch Siêu Thị Đà Nẵng,"Siêu thị Đà Nẵng, thành phố Đà Nẵng"
Agribank - Phòng giao dịch Nguyễn Văn Linh,"118 đường Nguyễn Văn Linh, quận Thanh Khê, TP Đà Nẵng"
Agribank - Phòng giao dịch An Khê,"165 Trường Chinh, thành phố Đà Nẵng"
Agribank - Chi nhánh NHNo&PTNT Quận Thanh Khê,"18 Võ Văn Tần,quận Thanh Khê, Thành phố Đà Nẵng"
Agribank - Chi nhánh NHNo&PTNT ông Ích Khiêm,"542 Ông Ích Khiêm, thành phố Đà Nẵng"
Agribank - Chi nhánh NHNo&PTNT Chợ Cồn,"334 Ông Ích Khiêm, thành phố Đà Nẵng"
Agribank - Phòng giao dịch Nguyệt Hóa,"Khóm 6, phường 8, Thị xã Trà Vinh, tỉnh Trà Vinh"
Agribank - Phòng giao dịch Hoà Lợi,"Ấp Qui nông A xã Hòa Lợi, huyện Châu Thành, tỉnh Trà Vinh"
Agribank - Chi nhánh NHNo&PTNT Huyện Châu Thành,"Khóm 2, thị trấn Châu Thành, huyện Châu Thành, tỉnh Trà Vinh"
Agribank - Phòng giao dịch Bình Phú,"xã Bình Phú, huyện Càng Long, tỉnh Trà Vinh"
Agribank - Phòng giao dịch Tân Bình,"Xã Tân Bình, huyện Càng Long, tỉnh Trà Vinh"
Agribank - Chi nhánh NHNo&PTNT Huyện Càng Long,"Khóm 3, thị trấn Càng Long, huyện Càng Long, tỉnh Trà Vinh"
Agribank - Phòng giao dịch Phong Phú,"Ấp Kinh xáng, xã Phong Phú, Huyện Cầu Kề, tỉnh Trà Vinh"
Agribank - Chi nhánh NHNo&PTNT Huyện Cầu Kề,"thị trấn Cầu Khè, huyện Cầu Kề, tỉnh Trà Vinh"
Agribank - Phòng giao dịch thị trấn Cầu Ngang,"Thị trấn Cầu Ngang, huyện Cầu Ngang, tỉnh Trà Vinh"
Agribank - Phòng giao dịch Mỹ Long,"Khóm 2, thị trấn Mỹ Long, huyện Cầu Ngang, tỉnh Trà Vinh"
Agribank - Chi nhánh NHNo&PTNT Huyện Cầu Ngang,"Thị trấn Cầu Ngang, huyện Cầu Ngang, tỉnh Trà Vinh"
Agribank - Phòng giao dịch Xã Long Hữu,"Ấp 10, xã Long Hữu, huyện Duyên Hải, tỉnh Trà Vinh"
Agribank - Chi nhánh NHNo&PTNT Huyện Duyên Hải,"Khóm 1, thị trấn DuYên Hải, huyện Duyên Hải , tỉnh Trà Vinh"
Agribank - Phòng giao dịch Long Thới,"246 Nguyễn Huệ, khóm 1,Thị trấn Cầu Quan, huyện Tiểu Cần, tỉnh Trà Vinh"
Agribank - Chi nhánh NHNo&PTNT Huỵện Tiểu Cần,"Số 002, khóm 1, thị trấn Tiểu Cần, huyện Tiểu Cần, tỉnh Trà Vinh"
Agribank - Phòng giao dịch Tập Sơn,"Ấp Bà Tây A, xã Tập Sơn, huyện Trà Cú, tỉnh Trà Vinh"
Agribank - Phòng giao dịch Đại An,"Xã Đại An, huyện Trà Cú"
Agribank - Chi nhánh NHNo&PTNT Huyện Trà Cú,"Khóm 5, thị trấn Trà Cú, huyện Trà Cú, tỉnh Trà Vinh"
Agribank - Chi nhánh NHNo&PTNT Số 2,"24, Trần Phú, phường 3, thị xã Trà Vinh, tỉnh Trà Vinh"
Agribank - Chi nhánh NHNo&PTNT Số 1,"65-67, Quang Trung, phường 2, thị xã Trà Vinh, tỉnh Trà Vinh"
Agribank - Chi Nhánh NHNo & PTNT Tỉnh Trà Vinh,"138 Trần Quốc Tuấn, Phường 2, Thị xã Trà Vinh, tỉnh Trà Vinh"
Agribank - Chi nhánh NHNo&PTNT Thị xã Trà Vinh,"70-72 Lê Lợi, Phường 2 , Thị xã Trà Vinh, tỉnh Trà Vinh"
Agribank - Phòng giao dịch Vinh Quang,"Xã Vinh Quang , huyện Chiêm Hoá, tỉnh Tuyên Quang"
Agribank - Phòng giao dịch số 1,"Thị Trấn Vĩnh Lộc , huyện Chiêm Hoá, tỉnh Tuyên Quang"
Agribank - Phòng giao dịch Minh Đức,"Xã Minh Đức , huyện Chiêm Hoá, tỉnh Tuyên Quang"
Agribank - Chi nhánh NHNo&PTNT Huyện Chiêm Hoá,"Thị trấn Vĩnh Lộc , huyện Hàm Yên, tỉnh Tuyên Quang"
Agribank - Phòng giao dịch Thái Hoà,"xã Thái Hoà , huyện Hàm Yên, tỉnh Tuyên Quang"
Agribank - Phòng giao dịch Phù Lưu,"xã Phù lưu , huyện Hàm Yên, tỉnh Tuyên Quang"
Agribank - Chi nhánh NHNo&PTNT huyện Hàm Yên,"Thị trấn Tân Yên , huyện Hàm Yên, tỉnh Tuyên Quang"
Agribank - Phòng giao dịch Yên Hoa,"Xã Yên Hoa , huyện Na Hang, tỉnh Tuyên Quang"
Agribank - Phòng giao dịch Thượng Lâm,"Xã Thượng Lâm , huyện Na Hang, tỉnh Tuyên Quang"
Agribank - Chi nhánh NHNo&PTNT huyện Na Hang,"Thị Trấn Na Hang , huyện Na Hang, tỉnh Tuyên Quang"
Agribank - Phòng giao dịch Tân Trào,"Xã Tân Trào, huyện Sơn Dương, tỉnh Tuyên Quang"
Agribank - Phòng giao dịch Sơn Nam,"Xã Sơn Nam, huyện Sơn Dương, tỉnh Tuyên Quang"
Agribank - Phòng giao dịch số 2,"Xã Kháng Nhật, huyện Sơn Dương, tỉnh Tuyên Quang"
Agribank - Phòng giao dịch số 1,"Thị trấn Sơn Dương, huyện Sơn Dương, tỉnh Tuyên Quang"
Agribank - Phòng giao dịch Kim Xuyên,"Xã Hồng Lạc, huyện Sơn Dương, tỉnh Tuyên Quang"
Agribank - Phòng giao dịch Đông Thọ,"Xã Đông Thọ, huyện Sơn Dương, tỉnh Tuyên Quang"
Agribank - Chi nhánh NHNo&PTNT huyện Sơn Dương,"Thị trấn Sơn Dương, huyện Sơn Dương, tỉnh Tuyên Quang"
Agribank - Phòng giao dịch Xuân Vân,"Xã Xuân Vân, huyện Yên Sơn, tỉnh Tuyên Quang"
Agribank - Phòng giao dịch Trung Môn,"Xã Trung Môn, huyện Yên Sơn, tỉnh Tuyên Quang"
Agribank - Phòng Giao dịch Tân Bình An,"Xã Lưỡng Vượng, huyện Yên Sơn, tỉnh Tuyên Quang"
Agribank - Phòng giao dịch số 2,"Thị trấn Tân Bình, huyện Yên Sơn, tỉnh Tuyên Quang"
Agribank - Phòng giao dịch số 1,"Xã An Tường, huyện Yên Sơn, tỉnh Tuyên Quang"
Agribank - Phòng giao dịch Mỹ Lâm,"Xã Mỹ Bằng, huyện Yên Sơn, tỉnh Tuyên Quang"
Agribank - Phòng Giao dịch ATK,"Xã Trung Sơn, huyện Yên Sơn, tỉnh Tuyên Quang"
Agribank - Chi nhánh NHNo&PTNT huyện Yên Sơn,"Xã An Tường, huyện Yên Sơn, tỉnh Tuyên Quang"
Agribank - Phòng giao dịch số 3,"Xã Tràng Đà- Thị xã Tuyên Quang, tỉnh Tuyên Quang"
Agribank - Phòng giao dịch số 2,"Phường Minh Xuân- thị xã Tuyên Quang, tỉnh Tuyên Quang"
Agribank - Phòng giao dịch số 1,"Phường Phan Thiết- Thị xã Tuyên Quang, tỉnh Tuyên Quang"
Agribank - Phòng giao dịch số 01,"Phường Tân Quang, Thị xã Tuyên Quang, tỉnh Tuyên Quang"
Agribank - Chi Nhánh NHNo & PTNT Tỉnh Tuyên Quang,"Phường Minh Xuân, thị xã Tuyên Quang, tỉnh Tuyên Quang"
Agribank - Chi Nhánh NHNo & PTNT Thị xã Tuyên Quang,"Phường Tân Quang, Thị xã Tuyên Quang, tỉnh Tuyên Quang"
Agribank - Chi nhánh NHNo&PTNT huyện Bến Cầu,"Thị Trấn Bến Cầu, huyện Bến Cát, tỉnh Tây Ninh"
Agribank - Phòng giao dịch Khu vực Thành Long,"Xã Thành Long, huyện Châu Thành , tỉnh Tây Ninh"
Agribank - Phòng giao dịch Khu vực An Cơ,"Xã Hảo Đước, huyện Châu Thành , tỉnh Tây Ninh"
Agribank - Chi nhánh NHNo&PTNT huyện Châu Thành,"Thị Trấn Châu Thành, huyện Châu Thành, tỉnh Tây Ninh"
Agribank - Phòng giao dịch Khu vực Cầu Khởi,"Xã Cầu Khởi, huyện Dương Minh Châu , tỉnh Tây Ninh"
Agribank - Chi nhánh NHNo&PTNT huyện Dương Minh Châu,"Thị Trấn Dương Minh Châu, huyện Dương Minh Châu, tỉnh Tây Ninh"
Agribank - Phòng giao dịch Khu vực Phước Đông,"Xã phước Đông, huyện Gò Dầu , tỉnh Tây Ninh"
Agribank - Chi nhánh NHNo&PTNT huyện Gò Dầu,"Thị Trấn Gò Dầu, huyện Gò Dầu, tỉnh Tây Ninh"
Agribank - Chi nhánh NHNo&PTNT huyện Hòa Thành,"Thị Trấn Hòa Thành , huyện Hoà Thành, tỉnh Tây Ninh"
Agribank - Phòng giao dịch thị trấn Trảng Bàng,"Ấp lộc Thành, Thị Trấn Trảng Bàng ,huyên Trảng Bàng, tỉnh Tây Ninh"
Agribank - Phòng giao dịch Khu vực Lộc Hưng,"Xã lộc Hưng, huyện Trảng Bàng , tỉnh Tây Ninh"
Agribank - Phòng giao dịch Khu vực Bình Thạnh,"Xã bình Thạnh, huyện Trảng Bàng , tỉnh Tây Ninh"
Agribank - Chi nhánh NHNo&PTNT huyện Trảng Bàng,"Thị Trấn Trảng Bàng, huyện Trảng Bàng, tỉnh Tây Ninh"
Agribank - Chi nhánh NHNo&PTNT Khu Công Nghiêp Trảng bàng,"khu công nghiệp Trảng Bàng, tỉnh Tây Ninh"
Agribank - Chi nhánh NHNo&PTNT huyện Tân Biên,"Thị Trấn Tân Biên, huyện Tân Biên, tỉnh Tây Ninh"
Agribank - Chi nhánh NHNo&PTNT khu vực Mía đường Tân Hưng,"Xã tân Hưng, huyện Tân Châu, tỉnh Tây Ninh"
Agribank - Chi nhánh NHNo&PTNT huyện Tân Châu,"Thị Trấn Tân Châu, huyện Tân Châu, tỉnh Tây Ninh"
Agribank - Phòng giao dịch Phường 3,"Đường 30/4 phường 3, Thị Xã Tây Ninh, tỉnh Tây Ninh"
Agribank - Phòng giao dịch khu vực Hiệp Ninh,"Phường Hiệp Ninh, Thị Xã Tây Ninh, tỉnh Tây Ninh"
Agribank - Phòng giao dịch Chợ Mới,"Đường Nguyễn Văn Chiêu, Phường II, Thị xã Tây Ninh, Tỉnh Tây Ninh"
Agribank - Chi Nhánh NHNo & PTNT Tỉnh Tây Ninh,"468 Cách Mạng Tháng 8, phường 3, Thị Xã Tây Ninh"
Agribank - Phòng giao dịch Thị Trấn Cái Vồn,"5/7 Ngô Quyền - Thị trấn Cái Vồn , huyện Bình Minh, tỉnh Vĩnh Long"
Agribank - Phòng giao dịch Tân Lược,"Ấp Tân Vĩnh - xã Tân Lược , huyện Bình Minh, tỉnh Vĩnh Long"
Agribank - Phòng giao dịch Đông Bình,"Ấp Đông Hậu - xã Đông Bình , huyện Bình Minh, tỉnh Vĩnh Long"
Agribank - Chi nhánh NHNo&PTNT huyện Bình Minh,"165/15 Khóm 1 - Ngô Quyền - Thị trấn Cái Vồn , huyện Bình Minh, tỉnh Vĩnh Long"
Agribank - Chi nhánh NHNo&PTNT Bình Tân,"Ấp Tân Thuận - xã Tân Qưới , huyện Bình Minh, tỉnh Vĩnh Long"
Agribank - Phòng giao dịch Mỹ Thuận,"Xã Mỹ Thuận, huyện Bình Tân, Vĩnh Long"
Agribank - Phòng giao dịch An Bình,"Ấp An Thuận - xã An Bình , huyện Long Hồ, tỉnh Vĩnh Long"
Agribank - Phòng giao dịch Thanh Đức,"Ấp Long Hưng, Xã Thanh Đức, Huyện Long Hồ, Tỉnh Vĩnh Long"
Agribank - Phòng giao dịch Phú Qưới,"Ấp Phú An - xã Phú Qưới , huyện Long Hồ, tỉnh Vĩnh Long"
Agribank - Phòng giao dịch Hoà Ninh,"Ấp bình Thuận - xã Hòa Ninh , huyện Long Hồ, tỉnh Vĩnh Long"
Agribank - Chi nhánh NHNo&PTNT huyện Long Hồ,"Khóm 5 - Thị trấn Long Hồ, huyện Long Hồ, tỉnh Vĩnh Long"
"Agribank - Ấp Phước Long- xã Lộc Hòa , huyện Long Hồ, tỉnh Vĩnh Long","Ấp Phước Long- xã Lộc Hòa , huyện Long Hồ, tỉnh Vĩnh Long"
Agribank - Phòng giao dịch Mỹ An,"Ấp Hòa Long - xã Mỹ An , huyện Mang Thít, tỉnh Vĩnh Long"
Agribank - Phòng giao dịch Hoà Mỹ,"Ấp Bình Tịnh - xã Hòa Tịnh , huyện Mang Thít, tỉnh Vĩnh Long"
Agribank - Phòng giao dịch Bình Phước,"Ấp Bình Tường - xã Bình Phước , huyện Mang Thít, tỉnh Vĩnh Long"
Agribank - Phòng giao dịch An Phước,"Ấp Thanh Thủy - xã An Phước , huyện Mang Thít, tỉnh Vĩnh Long"
Agribank - Chi nhánh NHNo&PTNT huyện Măng Thít,"Khóm 1 - thị trấn Cái Nhum , huyện Mang Thít, tỉnh Vĩnh Long"
Agribank - Phòng giao dịch Song Phú,"Ấp Phú Tường - xã Song Phú , huyện Tam Bình, tỉnh Vĩnh Long"
Agribank - Phòng giao dịch Hoà Hiệp,"Ấp 10 - xã Hòa Hiệp , huyện Tam Bình, tỉnh Vĩnh Long"
Agribank - Phòng giao dịch Cái Ngang,"Ấp Mỹ Phú - xã Mỹ Lộc , huyện Tam Bình, tỉnh Vĩnh Long"
Agribank - Phòng giao dịch Bình Ninh,"Ấp Mỹ An, Xã Bình Ninh, Huyện Tam Bình, Tỉnh Vĩnh Long"
Agribank - Chi nhánh NHNo&PTNT huyện Tam Bình,"Khóm 2 - Thị trấn Tam Bình , huyện Tam Bình, tỉnh Vĩnh Long"
Agribank - Phòng giao dịch Vĩnh Xuân,"Khu Phố chợ Vĩnh Xuân - xã Vĩnh Xuân , huyện Trà Ôn, tỉnh Vĩnh Long"
Agribank - Phòng giao dịch Hựu Thành,"Khu Phố chợ Hựu Thành - xã Hựu Thành -, huyện Trà Ôn, tỉnh Vĩnh Long"
Agribank - Phòng giao dịch Hoà Bình,"Xã Hoà Bình , huyện Trà Ôn, tỉnh Vĩnh Long"
Agribank - Chi nhánh NHNo&PTNT huyện Trà Ôn,"30B Gia Long - Thị trấn Trà Ôn , huyện Trà Ôn, tỉnh Vĩnh Long"
Agribank - Phòng giao dịch Trung Hiếu,"Xã Trung Hiếu, huyện Vũng Liêm, Vĩnh Long"
Agribank - Phòng giao dịch Thanh Bình,"Ấp Thái Bình - xã Thanh Bình , huyện Vũng Liêm, tỉnh Vĩnh Long"
Agribank - Phòng giao dịch Hiếu Phụng,"Ấp Tân Quang - xã Hiếu Phụng , huyện Vũng Liêm, tỉnh Vĩnh Long"
Agribank - Phòng giao dịch Hiếu Nhơn,"Ấp Hiếu Minh - xã Hiếu Nhơn , huyện Vũng Liêm, tỉnh Vĩnh Long"
Agribank - Phòng giao dịch Cầu Mới,"Ấp 7 - xã Tân An Luông , huyện Vũng Liêm, tỉnh Vĩnh Long"
Agribank - Chi nhánh NHNo&PTNT huyện Vũng Liêm,"Khóm 2 - Thị trấn Vũng Liêm , huyện Vũng Liêm, tỉnh Vĩnh Long"
Agribank - Phòng giao diịch Mỹ Thuận,"270 QL 1A -ấp Tân Thuận An- xã Tân Ngãi - thị xã Vĩnh Long, tỉnh Vĩnh Long"
Agribank - Phòng giao dịch Nguyễn Huệ,"29 Nguyễn Huệphường 2 - thị xã Vĩnh Long, tỉnh Vĩnh Long"
Agribank - Phòng giao dịch số 1,"51/11 Phạm Thái Bường - P4 - thị xã Vĩnh Long, tỉnh Vĩnh Long"
Agribank - Phòng giao dịch Long Châu,"47 đường 1/5-P1 - thị xã Vĩnh Long, tỉnh Vĩnh Long"
Agribank - Chi nhánh NHNo&PTNT Thị xã Vĩnh Long,"14 Hùng Vương- P1 - thị xã Vĩnh Long, tỉnh Vĩnh Long"
Agribank - Phòng giao dịch Quang Hà,"Xã Gia Khánh, huyện Bình Xuyên, tỉnh Vĩnh Phúc"
Agribank - Phòng giao dịch Phú Xuân,"Xã Phú xuân, huyện Bình Xuyên, tỉnh Vĩnh Phúc"
Agribank - Phòng giao dịch Bá Thiện,"Khu Đồng Bay, thông Bá Cầu, xã Sơn Lôi, huyện Bình Xuyên, tỉnh Vĩnh Phúc"
Agribank - Chi nhánh NHNo&PTNT Huyện Bình Xuyên,"Thị trấn Hương canh, huyện Xuyên, tỉnh Vĩnh Phúc"
Agribank - Phòng giao dịch Triệu Đề,"Xã Triệu đề, huyện Lập Thạch, tỉnh Vĩnh Phúc"
Agribank - Phòng giao dịch Tam Sơn,"Xã Tam sơn, huyện Lập Thạch, tỉnh Vĩnh Phúc"
Agribank - Phòng giao dịch Liễn Sơn,"Xã Liễn sơn, huyện Lập Thạch, tỉnh Vĩnh Phúc"
Agribank - Chi nhánh NHNo&PTNT huyện Lập Thạch,"Xã Xuân hoà, huyện Lập Thạch, tỉnh Vĩnh Phúc"
Agribank - Phòng giao dịch Vân Hội,"Xã Vân hội, huyện Tam Dương, tỉnh Vĩnh Phúc"
Agribank - Chi nh¸nh NHNo&PTNT huyÖn Tam D­¬ng,"Thị trấn Hợp Hòa, huyện Tam Dương, tỉnh Vĩnh Phúc"
Agribank - Chi nhánh NHNo&PTNT Huyện Tam đảo,"Xã Hợp Châu, huyện Tam Đảo, tỉnh Vĩnh Phúc"
Agribank - Phòng giao dịch Chấn Hưng,"Xã Chấn Hưng, huyện Vĩnh Tường, thành phố Hải Phòng"
Agribank - Phòng giao dịch Bồ Sao,"Xã Bồ sao, huyện Vĩnh tường, tỉnh Vĩnh Phúc"
Agribank - Chi nhánh NHNo&PTNT Thổ Tang,"Xã Thổ Tang, huyện Vĩnh tường, tỉnh Vĩnh Phúc"
Agribank - Chi nhánh NHNo&PTNT Huyện Vĩnh tường,"Thị trấn Vĩnh Tường, huyện Vĩnh Tường, tỉnh Vĩnh Phúc"
Agribank - Phòng giao dịch Nguyệt Đức,"Xã Nguyệt đức, huyện Yên Lạc, tỉnh Vĩnh Phúc"
Agribank - Phòng giao dịch Liên Châu,"Xã Liên châu, huyện Yên Lạc, tỉnh Vĩnh Phúc"
Agribank - Phòng giao dịch Đồng Văn,"Xã Đồng văn, huyện Yên Lạc, tỉnh Vĩnh Phúc"
Agribank - Chi nhánh NHNo&PTNT Huyện huyện Yên Lạc,"Thị trấn Yên Lạc, huyện Yên Lạc, tỉnh Vĩnh Phúc"
Agribank - Phòng giao dịch Xuân Hòa,"Phường Xuân hòa, Thị xã Phúc Yên, tỉnh Vĩnh Phúc"
Agribank - Chi Nhánh NHNo & PTNT Phúc Yên,"Phường Trưng Trắc, Thị xã Phúc Yên, tỉnh tỉnh Vĩnh Phúc"
Agribank - Phòng giao dịch Nam Vĩnh Yên,"Xã Khai quang, thị xã Vĩnh Yên, tỉnh Vĩnh Phúc"
Agribank - Phòng giao dịch Vĩnh Yên,"Phường Ngô Quyền, thị xã Vĩnh Yên, tỉnh Vĩnh Phúc"
Agribank - Chi nhánh NHNo&PTNT Bắc Vĩnh Yên,"Phường Đồng Tâm, thị xã Vĩnh Yên, tỉnh Vĩnh Phúc"
Agribank - Chi Nhánh NHNo & PTNT Tỉnh Vĩnh Phúc,"Phường Liên Bảo, thị xã Vĩnh Yên, tỉnh Vĩnh Phúc"
Agribank - Phòng giao dịch Yên thế,"Thị Trấn Yên Thế , huyện Lục Yên, tỉnh Yên Bái"
Agribank - Phòng giao dịch Hồng Quang,"Xã Động Quan , huyện Lục Yên, tỉnh Yên Bái"
Agribank - Chi nhánh NHNo&PTNT Huyện Lục Yên,"Thị Trấn Yên Thế , huyện Lục Yên, tỉnh Yên Bái"
Agribank - Chi nhánh NHNo&PTNT Huyện Mù Cang Chải,"Thị Trấn Mù Cang CHải, huyện Mù Căng CHải, tỉnh Yên Bái"
Agribank - Chi nhánh NHNo&PTNT Huyện Trạm tấu,"Thị trấn Trạm Tấu, huyện Trạm Tấu, tỉnh Yên Bái"
Agribank - Phòng giao dịch Văn Tiến,"Xã Văn Tiến , huyện Trấn Yên, tỉnh Yên Bái"
Agribank - Phòng giao dịch Hợp Minh,"Xã Hợp Minh , huyện Trấn Yên, tỉnh Yên Bái"
Agribank - Chi nhánh NHNo&PTNT Huyện Trấn Yên,"Khu phố 6, Thị Trấn Cổ Phúc , huyện Trấn Yên, tỉnh Yên Bái"
Agribank - Phòng giao dịch Vực Tuần,"Thị Trấn Trần Phú , huyện Văn Chấn, tỉnh Yên Bái"
Agribank - Phòng giao dịch Tân Thịnh,"Xã Tân Thịnh , huyện Văn Chấn, tỉnh Yên Bái"
Agribank - Phòng giao dịch Mường Lò,"Xã Phù Nham , huyện Văn Chấn, tỉnh Yên Bái"
Agribank - Phòng giao dịch Liên Sơn,"Thị Trấn Liên Sơn , huyện Văn Chấn, tỉnh Yên Bái"
Agribank - Chi nhánh NHNo&PTNT huyện Văn Chấn,"Xã sơn thịnh , huyện Văn Chấn, tỉnh Yên Bái"
Agribank - Phòng giao dịch Trái Hút,"Xã An Bình , huyện Văn Yên, tỉnh Yên Bái"
Agribank - Phòng giao dịch An Thịnh,"Xã An Thịnh , huyện Văn Yên, tỉnh Yên Bái"
Agribank - Chi nhánh NHNo&PTNT Huyện Văn Yên,"Khu phố 3, Thị Trấn Mậu A , huyện Văn Yên, tỉnh Yên Bái"
