LienVietPostBank - Chi nhánh Thường Tín,"Số 54-56 phố Ga, thị trấn Thường Tín, huyện Thường Tín, thành phố Hà Nội"
LienVietPostBank - PGD Thạch Thất,"Thôn Thái Hòa, xã Bình Phú, huyện Thạch Thất, thành phố Hà Nội"
LienVietPostBank - Chi nhánh Sơn Tây,"205-207 Chùa Thông, phường Sơn Lộc, thị xã Sơn Tây, TP. Hà Nội"
LienVietPostBank - Chi nhánh Tiết kiệm Bưu điện,"493 Lạc Long Quân, phường Xuân La, quận Tây Hồ, thành phố Hà Nội"
LienVietPostBank - PGD Đan Phượng,"Số 5 Nguyễn Thái Học, thị trấn Phùng, huyện Đan Phượng, thành phố Hà Nội"
LienVietPostBank - Chi nhánh Đông Anh,"Số 54-56 đường Cao Lỗ, thị trấn Đông Anh, huyện Đông Anh, thành phố Hà Nội"
LienVietPostBank - PGD Đống Đa,"Số 35 Thái Hà, Phường Trung Liệt, Quận Đống Đa, TP Hà Nội"
LienVietPostBank - CN Hà Nội,"Số 135-137 Xã Đàn, Phường Phương Liên, Quận Đống Đa, TP Hà Nội"
LienVietPostBank - PGD Ứng Hòa,"Số 17 phố Trần Đăng Ninh, thị trấn Vân Đình, huyện Ứng Hòa, thành phố Hà Nộ"
LienVietPostBank - PGD Cao Phong,"Khu 2, thị trấn Cao Phong, huyện Cao Phong, tỉnh Hòa Bình"
LienVietPostBank - PGD Kim Bôi,"Phố Bưởi, xã Hạ Bì, huyện Kim Bôi, tỉnh Hòa Bình"
LienVietPostBank - PGD Kỳ Sơn,"Khu 1, thị trấn Kỳ Sơn, huyện Kỳ Sơn, tỉnh Hòa Bình"
LienVietPostBank - PGD Lương Sơn,"Tiểu khu 8, thị trấn Lương Sơn, huyện Lương Sơn, tỉnh Hòa Bình"
LienVietPostBank - PGD Lạc Sơn,"Phố Thống Nhất, thị Trấn Vụ Bản, huyện Lạc Sơn, tỉnh Hoà Bình"
LienVietPostBank - PGD Lạc Thủy,"Khu phố 3, thị trấn Chi Nê, huyện Lạc Thủy, tỉnh Hòa Bình"
LienVietPostBank - PGD Mai Châu,"Tiểu khu 2, thị trấn Mai Châu, huyện Mai Châu, tỉnh Hoà Bình"
LienVietPostBank - PGD Tân Lạc,"Khu 1B, thị trấn Mường Khến, huyện Tân Lạc, tỉnh Hòa Bình"
LienVietPostBank - PGD Yên Thủy,"Khu phố 12, thị trấn Hàng Trạm, huyện Yên Thủy, tỉnh Hòa Bình"
LienVietPostBank - PGD Đà Bắc,Tiểu khu Liên Phương – thị Trấn Đà Bắc - huyện Đà Bắc – tỉnh Hòa Bình
LienVietPostBank - CN Hòa Bình,"Đường Trần Hưng Đạo, phường Phương Lâm, thành phố Hòa Bình, tỉnh Hòa Bình."
LienVietPostBank - CN Hưng Yên,"Số 537 Nguyễn Văn Linh, phường Hiến Nam, thành phố Hưng Yên, tỉnh Hưng Yên"
LienVietPostBank - PGD Bình Giang,"Số 1, khu 3, thị trấn Kẻ Sặt, huyện Bình Giang, tỉnh Hải Dương"
LienVietPostBank - PGD Gia Lộc,"318 Nguyễn Chế Nghĩa, thị trấn Gia Lộc, huyện Gia Lộc, tỉnh Hải Dương"
LienVietPostBank - PGD Kim Thành,"Thôn Phạm Xá 1, xã Tuấn Hưng, huyện Kim Thành, tỉnh Hải Dương"
LienVietPostBank - PGD Kinh Môn,"Thôn Tây Sơn, xã Hiệp An, huyện Kinh Môn, tỉnh Hải Dương"
LienVietPostBank - PGD Nam Sách,"Phố Mới, thị trấn Nam Sách, huyện Nam Sách, tỉnh Hải Dương"
LienVietPostBank - PGD Ninh Giang,"Đường Khúc Thừa Dụ, thị trần Ninh Giang, huyện Ninh Giang, tỉnh Hải Dương"
LienVietPostBank - PGD Thanh Hà,"Thôn Du La, xã Cẩm Chế, huyện Thanh Hà, tỉnh Hải Dương"
LienVietPostBank - PGD Thanh Miện,"Thôn La Ngoại, xã Ngũ Hùng, huyện Thanh Miện, tỉnh Hải Dương"
LienVietPostBank - PGD Tứ Kỳ,"Số 157 đường 391 thị trấn Tứ Kỳ, huyện Tứ Kỳ, tỉnh Hải Dương"
LienVietPostBank - CN Hải Dương,"Số 62 Ngô Quyền, phường Phạm Ngũ Lão, tp Hải Dương, tỉnh Hải Dương"
LienVietPostBank - PGD Chí Linh,"Khu Dân cư Lôi Động, phường Cộng Hòa, thị xã Chí Linh, tỉnh Hải Dương"
LienVietPostBank - PGD Tân Phú Thạnh,"Số 418A, quốc lộ 1, ấp Tân Phú, thị trấn Cái Tắc, huyện Châu Thành A, tỉnh Hậu Giang."
LienVietPostBank - PGD Long Mỹ,"Số 16 – 18 đường 30-4, thị trấn Long Mỹ, huyện Long Mỹ, tỉnh Hậu Giang."
LienVietPostBank - CN Hậu Giang,"Số 32 Nguyễn Công Trứ, phường 1, thành phố Vị Thanh, tỉnh Hậu Giang."
LienVietPostBank - PGD Vị Thanh,"Số 1107 đường Trần Hưng Đạo, Phường 7, TP. Vị Thanh, tỉnh Hậu Giang."
LienVietPostBank - PGD Vạn Ninh,"Số 275 Hùng Vương, thị trấn Vạn Giã, huyện Vạn Ninh, tỉnh Khánh Hòa"
LienVietPostBank - PGD Cam Ranh,"Số 156, đường 22/8, TDP Thuận Phát, thị phường Cam Thuận, thành phố Cam Ranh, tỉnh Khánh Hòa."
LienVietPostBank - CN Khánh Hòa,"Số 69 - 71 phố Thống Nhất, phường Vạn Thạnh, TP. Nha Trang, tỉnh Khánh Hòa."
LienVietPostBank - PGD An Biên,"Khu vực 2, thị trấn Thứ Ba, huyện An Biên, tỉnh Kiên Giang"
LienVietPostBank - PGD An Minh,"Khu vực 2, thị trần Thứ Mười Một, huyện An Minh, tỉnh Kiên Giang"
LienVietPostBank - PGD Gò Quao,"Ấp Phước Hưng 1, thị trấn Gò Quao, huyện Gò Quao, tỉnh Kiên Giang"
LienVietPostBank - PGD Phú Quốc,"Số 10, đường 30/4, khu phố 2, thị trấn Dương Đông, huyện Phú Quốc, tỉnh Kiên Giang"
LienVietPostBank - PGD Tân Hiệp,"Số 33, khóm B, thị trấn Tân Hiệp, huyện Tân Hiệp, tỉnh Kiên Giang"
LienVietPostBank - PGD U Minh Thượng,"Ấp Cạn Ngọn A, xã Thạnh Yên, huyện U Minh Thượng, tỉnh Kiên Giang"
LienVietPostBank - PGD Vĩnh Thuận,"Ấp Vĩnh Đông II, thị trấn Vĩnh Thuận, huyện Vĩnh Thuận, tỉnh Kiên Giang"
LienVietPostBank - CN Kiên Giang,"Số C9 - 19 đường Lạc Hồng, phường Vĩnh Lạc, thành phố Rạch Giá, tỉnh Kiên Giang"
LienVietPostBank - PGD Hà Tiên,"Số 03, đường Tô Châu, phường Đông Hồ, thị xã Hà Tiên, tỉnh Kiên Giang"
LienVietPostBank - PGD Kon Plong,"Thôn Măng Đen, thị trấn Măng Đen, huyện Kon Plong, tỉnh Kon Tum"
LienVietPostBank - PGD Ngọc Hồi,"Số 35 Hùng Vương, thị trấn Plei Kần, huyện Ngọc Hồi, tỉnh Kon Tum"
LienVietPostBank - PGD Sa Thầy,"Số 326 Trần hưng Đạo, thị trấn Sa Thầy, huyện Sa Thầy, tỉnh Kon Tum"
LienVietPostBank - PGD Đắk Glei,"Số 455 Hùng Vương, thị trấn Đắk Glei, huyện Đắk Glei, tỉnh Kon Tum."
LienVietPostBank - PGD Đắk Hà,"Số 212 Hùng Vương, thị trấn Đắk Hà, huyện Đắk Hà, tỉnh Kon Tum"
LienVietPostBank - PGD Đắk Tô,"Số 07 Hùng Vương, thị trấn Đắk Tô, huyện Đắk Tô, tỉnh Kon Tum"
LienVietPostBank - CN Kon Tum,"Số 72 đường Lê Hồng Phong, phường Quyết Thắng, thành phố Kon Tum, tỉnh Kon Tum."
LienVietPostBank - PGD Mường Tè,"Khu phố 8, thị trấn Mường tè, huyện Mường Tè, tỉnh Lai Châu"
LienVietPostBank - PGD Sìn Hồ,"Khu 3, thị trấn Sìn Hồ, huyện Sìn Hồ, tỉnh Lai Châu"
LienVietPostBank - PGD Tân Uyên,"Tổ 15, thị trấn Tân Uyên, huyện Tân Uyên, tỉnh Lai Châu"
LienVietPostBank - CN Lai Châu,"Tổ 12, phường Tân Phong, thành phố Lai Châu, tỉnh Lai Châu"
LienVietPostBank - PGD Bến Lức,"Số 5 khu phố 4, QL 1A, thị Trấn Bến Lức, huyện Bến Lức, tỉnh Long An"
LienVietPostBank - PGD Châu Thành,"Số 47 tỉnh lộ 827A, khu phố 3, thị trấn Tẩm Vu, huyện Châu Thành, tỉnh Long An"
LienVietPostBank - PGD Cần Giuộc,"Số 106, quốc lộ 50, thị trấn Cần Giuộc, huyện Cần Giuộc, tỉnh Long An"
LienVietPostBank - PGD Cần Đước,"Khu 1 A Quốc Lộ 50, thị trấn Cần Đước, huyện Cần Đước, tỉnh Long An"
LienVietPostBank - PGD Thủ Thừa,"Số 42 Trưng Trắc, thị trấn Thủ Thừa, huyện Thủ Thừa, tỉnh Long An"
LienVietPostBank - PGD Tân Hưng,"Số 02 Trần Hưng Đạo, khu phố Gò Thuyền, thị trấn Tân Hưng, huyện Tân Hưng, tỉnh Long An"
LienVietPostBank - PGD Tân Thạnh,"Số 09, khu phố 1, thị trấn Tân Thạnh, huyện Tân Thạnh, tỉnh Long An"
LienVietPostBank - PGD Tân Trụ,"Ấp Tân Bình, thị trấn Tân Trụ, huyện Tân Trụ, tỉnh Long An"
LienVietPostBank - PGD Đức Huệ,"Số 55E, khu vực 1, thị trấn Đông Thành, huyện Đức Huệ, tỉnh Long An"
LienVietPostBank - PGD Hậu Nghĩa,"Ô 7, Khu B, thị trấn Hậu Nghĩa, huyện Đức Hòa, tỉnh Long An"
LienVietPostBank - CN Long An,"Số 123 -125 -127 đường Hùng Vương, phường 2, thành phố Tân An, tỉnh Long An."
LienVietPostBank - PGD Mộc Hóa,"Số 14, đường 30/4, khu phố 1, phường 1, thị xã Kiến Tường, tỉnh Long An"
LienVietPostBank - PGD Bát Xát,"Số 477, đường Hùng Vương, thị trấn Bát Xát, huyện Bát Xát, tỉnh Lào Cai"
LienVietPostBank - PGD Bảo Thắng,"Số nhà 174 đường Cách mạng Tháng 8, thị trấn Phố Lu, huyện Bảo Thắng, tỉnh Lào Cai"
LienVietPostBank - PGD Bảo Yên,"Số nhà 394 đường Nguyễn Tất Thành, thị trấn Phố Ràng, huyện Bảo Yên, tỉnh Lào Cai"
LienVietPostBank - PGD Bắc Hà,"Số 096 đường Ngọc Uyển, thị trấn Bắc Hà, huyện Bắc Hà, tỉnh Lào Cai"
LienVietPostBank - PGD Văn Bàn,"Tổ 7, thị trấn Khánh Yên, huyện Văn Bàn, tỉnh Lào Cai"
LienVietPostBank - CN Lào Cai,"Số 151, đường Hoàng Liên, phường Cốc Lếu, thành phồ Lào Cai, tỉnh Lào Cai"
LienVietPostBank - PGD Di Linh,"Số 535 đường Hùng Vương, thị trấn Di Linh, huyện Di Linh, tỉnh Lâm Đồng"
LienVietPostBank - PGD Lâm Hà,"Khu phố 3, thị trấn Đinh Văn, huyện Lâm Hà, tỉnh Lâm Đồng"
LienVietPostBank - PGD Đạ Huoai,"Khu phố 3, thị trấn Mađagui, huyện Đạ Huoai, tỉnh Lâm Đồng"
LienVietPostBank - PGD Đơn Dương,"Số 106 đường 2/4, thị trấn Thạnh Mỹ, huyện Đơn Dương, tỉnh Lâm Đồng"
LienVietPostBank - CN Lâm Đồng,"Số 707 Quốc lộ 20, thị trấn Liên Nghĩa, huyện Đức Trọng, tỉnh Lâm Đồng"
LienVietPostBank - PGD Đà Lạt,"Số 33 Bùi Thị Xuân, phường 2, thành phố Đà Lạt, tỉnh Lâm Đồng"
LienVietPostBank - PGD Đồng Đăng,"Khu Dây Thép, thị trấn Đồng Đăng, huyện Cao Lộc, tỉnh Lạng Sơn"
LienVietPostBank - PGD Hữu Lũng,"Số 235-237 đường Chi Lăng, khu Tân Mỹ 1, thị trấn Hữu Lũng, huyện Hữu Lũng, tỉnh Lạng Sơn."
LienVietPostBank - PGD Văn Lãng,"Số 62, khu 3, đường Chiến Thắng, thị trấn Na Sầm, huyện Văn Lãng, tỉnh Lạng Sơn"
LienVietPostBank - PGD Văn Lãng,"Số 62, khu 3, đường Chiến Thắng, thị trấn Na Sầm, huyện Văn Lãng, tỉnh Lạng Sơn"
LienVietPostBank - PGD Văn Quan,"Số 116, phố Đức Tâm II, thị trấn Văn Quan, huyện Văn Quan, tỉnh Lạng Sơn"
LienVietPostBank - PGD Đình Lập,"Khu 4, thị trấn Đình Lập, huyện Đình Lập, tỉnh Lạng Sơn"
LienVietPostBank - CN Lạng Sơn,"Đường Lý Thường Kiệt, khu đô thị Phú Lộc IV, phường Vĩnh Trại, thành phố Lạng Sơn, tỉnh Lạng Sơn"
LienVietPostBank - PGD Hải Hậu,"Tổ dân phố số 3, thị trấn Yên Định, huyện Hải Hậu, tỉnh Nam Định"
LienVietPostBank - PGD Nam Trực,"Thôn 4, thị trấn Nam Giang, huyện Nam Trực, tỉnh Nam Định"
LienVietPostBank - PGD Trực Ninh,"Số nhà 56A1 đường 21B, thị Trấn Cổ Lễ, huyện Trực Ninh, tỉnh Nam Định"
LienVietPostBank - PGD Xuân Trường,"Tổ 18, thị trấn Xuân Trường, huyện Xuân Trường, tỉnh Nam Định"
LienVietPostBank - PGD Ý Yên,"Đường 57 thông Tân Lập, xã Yên Tiến, huyện Ý Yên, tỉnh Nam Định"
LienVietPostBank - CN Nam Định,"Số 223 đường Trần Hưng Đạo, phường Bà Triệu, thành phố Nam Định, tỉnh Nam Định."
LienVietPostBank - PGD Con Cuông,"Khối 5, thị trấn Con Cuông, huyện Con Cuông, tỉnh Nghệ An"
LienVietPostBank - PGD Diễn Châu,"Khối 4, thị trấn Diễn Châu, huyện Diễn Châu, Tỉnh Nghệ An"
LienVietPostBank - PGD Hưng Nguyên,"Khối 15, thị trấn Hưng Nguyên, huyện Hưng Nguyên, tỉnh Nghệ An"
LienVietPostBank - PGD Kỳ Sơn,"Khối 4, thị trấn Mường Xén, huyện Kỳ Sơn, tỉnh Nghệ An"
LienVietPostBank - PGD Nam Đàn,"Khối Ba Hà, thị trấn Nam Đàn, huyện Nam Đàn, tỉnh Nghệ An"
LienVietPostBank - PGD Nghi Lộc,"Khối 4, thị trấn Quán Hành, huyện Nghi Lộc, tỉnh Nghệ An"
LienVietPostBank - PGD Nghĩa Đàn,"Khối Tân Hiếu, thị trấn Nghĩa Đàn, huyện Nghĩa Đàn, tỉnh Nghệ An"
LienVietPostBank - PGD Quế Phong,"Quốc lộ 16, khối 1, thị trấn Kim Sơn, huyện Quế Phong, tỉnh Nghệ An"
LienVietPostBank - PGD Quỳ Châu,"Khối 2B, thị trấn Tân Lạc, huyện Qùy Châu, tỉnh Nghệ An"
LienVietPostBank - PGD Quỳ Hợp,"Khối Đông Hồ, thị trấn Qùy Hợp, huyện Qùy Hợp, tỉnh Nghệ An"
LienVietPostBank - PGD Quỳnh Lưu,"Khối 1, thị trấn Giàu Cát, huyện Quỳnh Lưu, tỉnh Nghệ An"
LienVietPostBank - PGD Thanh Chương,"Khối 9, Thị trấn Dùng, huyện Thanh Chương, tỉnh Nghệ An"
LienVietPostBank - PGD Tân Kỳ,"Khối 8, thị trấn Tân Kỳ, huyện Tân Kỳ, tỉnh Nghệ An"
LienVietPostBank - PGD Tương Dương,"Khối Hòa Bắc, thị trấn Hòa Bình, huyện Tương Dương, tỉnh Nghệ An"
LienVietPostBank - PGD Yên Thành,"Khối 2, thị trấn Yên Thành, huyện Yên Thành, tỉnh Nghệ An"
LienVietPostBank - PGD Đô Lương,"Khu đô thị mới, Nam Thị trấn Đô Lương, huyện Đô Lương, tỉnh Nghệ An"
LienVietPostBank - PGD Hoàng Mai,"Quốc lộ 1A, khối Thịnh Mỹ, phường Quỳnh Thiện, thị xã Hoàng Mai, tỉnh Nghệ An"
LienVietPostBank - CN Nghệ An,"Số 20B Cao Thắng, phường Hồng Sơn, TP.Vinh, tỉnh Nghệ An."
LienVietPostBank - PGD Nguyễn Văn Cừ,"Số 187 đường Nguyễn Văn Cừ, phường Hưng Bình, TP. Vinh, tỉnh Nghệ An."
LienVietPostBank - PGD TX Cửa Lò,"Số 12 đường Nguyễn Sinh Cung, phường Nghi Hương, thị xã Cửa Lò, tỉnh Nghệ An"
LienVietPostBank - PGD Thái Hòa,"Số 311 đường Nguyễn Trãi, khối Kim Tân, phường Hòa Hiếu, thị xã Thái Hòa, tỉnh Nghệ An."
LienVietPostBank - PGD Ninh Hải,"Khu phố Ninh Trữ 2, thị trấn Khánh Hải, huyện Ninh Hải, tỉnh Ninh Thuận"
LienVietPostBank - PGD Ninh Sơn,"221 E đường Lê Duẩn, thị trấn Tân Sơn, huyện Ninh Sơn, tỉnh Ninh Thuận"
LienVietPostBank - PGD Cà Ná,"Thôn Lạc Sơn 2, xã Cà Ná, huyện Thuận Nam, tỉnh Ninh Thuận"
LienVietPostBank - CN Ninh Thuận,"Số 44 đường 16 tháng 4, phường Tấn Tài, thành phố Phan Rang - Tháp Chàm, tỉnh Ninh Thuận."
LienVietPostBank - PGD Cẩm Khê,"Khu 9, thị trấn Sông Thao, huyện Cẩm Khê, tỉnh Phú Thọ"
LienVietPostBank - PGD Hạ Hòa,"Khu 8, thị trấn Hà Hòa, huyện Hạ Hòa, tỉnh Phú Thọ"
LienVietPostBank - PGD Lâm Thao,"Khu Lâm Thao, thị trấn Lâm Thao, huyện Lâm Thao, tỉnh Phú Thọ"
LienVietPostBank - PGD Phù Ninh,"Tổ 8 khu Núi Trang, thị trấn Phong Châu, huyện Phù Ninh, tỉnh Phú Thọ"
LienVietPostBank - PGD Thanh Ba,"Khu 6, thị trấn Thanh Ba, huyện Thanh Ba, tỉnh Phú Thọ"
LienVietPostBank - PGD Thanh Sơn,"Số 174, 176 phố Ba Mỏ, thị trấn Thanh Sơn, huyện Thanh Sơn, tỉnh Phú Thọ"
LienVietPostBank - PGD Đoan Hùng,"Khu Tân Thành, thị trấn Đoan Hùng, huyện Đoan Hùng, tỉnh Phú Thọ"
LienVietPostBank - CN Phú Thọ,"Số 1172 Đại lộ Hùng Vương, phường Tiên Cát, thành phố Việt Trì, tỉnh Phú Thọ."
LienVietPostBank - PGD TX Phú Thọ,"Phố Long Xuyên, phường Hùng Vương, thị xã Phú Thọ, tỉnh Phú Thọ"
LienVietPostBank - PGD Bố Trạch,"Tiểu khu 11, đường Hùng Vương, thị trấn Hoàn Lão, huyện Bố Trạch, tỉnh Quảng Bình"
LienVietPostBank - PGD Lệ Thủy,"Thôn Thượng Giang, thị trấn Kiến Giang, huyện Lệ Thủy, tỉnh Quảng Bình"
LienVietPostBank - PGD Minh Hóa,"Tiểu khu 7, thị trấn Quy Đạt, huyện Minh Hóa, tỉnh Quảng Bình."
LienVietPostBank - PGD Quảng Ninh,"Thôn Dinh Mười, xã Gia Ninh, huyện Quảng Ninh, tỉnh Quảng Bình"
LienVietPostBank - PGD Bắc Quảng Trạch,"Thôn Di Luân, xã Quảng Tùng, huyện Quảng Trạch, tỉnh Quảng Bình"
LienVietPostBank - PGD Tuyên Hóa,"Tiểu khu 1, thị trấn Đồng Lê, huyện Tuyên Hóa, tỉnh Quảng Bình"
LienVietPostBank - CN Quảng Bình,"Số 01 đường Trần Hưng Đạo, phường Đồng Phú, thành phố Đồng Hới, tỉnh Quảng Bình"
LienVietPostBank - PGD Ba Đồn,"Số 375 Quang Trung, phường Ba Đồn, thị xã Ba Đồn, tỉnh Quảng Bình"
LienVietPostBank - PGD Bắc Trà My,"Số 15 Nguyễn Văn Linh, khu phố Đồng Bàu, thị trấn Trà My, huyện Bắc Trà My, tỉnh Quảng Nam"
LienVietPostBank - PGD Bắc Trà My,"Số 15 Nguyễn Văn Linh, khu phố Đồng Bàu, thị trấn Trà My, huyện Bắc Trà My, tỉnh Quảng Nam"
LienVietPostBank - PGD Duy Xuyên,"Số 174 Điện Biên Phủ, khối phố Long Xuyên 1, thị trấn Long Xuyên 1, huyện Duy Xuyên, tỉnh Quảng Nam"
LienVietPostBank - PGD Hiệp Đức,"Khối phố An Tây, thị trấn Tân An, huyện Hiệp Đức, tỉnh Quảng Nam"
LienVietPostBank - PGD Núi Thành,"Số 469 Phạm Văn Đồng, khối 3, thị trấn Núi Thành, huyện Núi Thành, tỉnh Quảng Nam"
LienVietPostBank - PGD Phước Sơn,"Số 45 đường Hồ Chi Minh, thị trấn Khâm Đức, huyện Phước Sơn, tỉnh Quảng Nam"
LienVietPostBank - PGD Quế Sơn,"Số 232 Hùng Vương, thị trấn Đông Phú, huyện Quế Sơn, tỉnh Quảng Nam"
LienVietPostBank - PGD Thăng Bình,"Số 49 Nguyễn Hoàng, khu phố 4, thị Trấn Hà Lam, huyện Thăng Bình, tỉnh Quảng Nam"
LienVietPostBank - PGD Điện Bàn,"Số 189 Trần nhân Tông, phường Vĩnh Điện, thị xã Điện Bàn, tỉnh Quảng Nam"
LienVietPostBank - PGD Đại Lộc,"Khu 7, thị trấn Ái Nghĩa, huyện Đại Lộc, tỉnh Quảng Nam"
LienVietPostBank - PGD Hội An,"Số 562 Hai Bà Trưng, khối Xuân Hòa, phường Cẩm Phô, thành phố Hội An, tỉnh Quảng Nam"
LienVietPostBank - CN Quảng Nam,"Số 196 – 198 Phan Chu Trinh, phường An Mỹ, thành phố Tam Kỳ, tỉnh Quảng Nam."
LienVietPostBank - PGD Bình Sơn,"Tổ dân phố 6, thị trấn Châu Ổ, huyện Bình Sơn, tỉnh Quảng Ngãi"
LienVietPostBank - PGD Lý Sơn,"Thôn Tây, xã An Hải, huyện Lý Sơn, tỉnh Quảng Ngãi"
LienVietPostBank - PGD Lý Sơn,"Thôn Tây, xã An Hải, huyện Lý Sơn, tỉnh Quảng Ngãi"
LienVietPostBank - PGD Trà Bồng,"Khu dân cư 10, tổ dân phố 1, thị trấn Trà Xuân, huyện Trà Bồng, tỉnh Quảng Ngãi"
LienVietPostBank - PGD Đức Phổ,"259 Nguyễn Nghiêm, thị trấn Đức Phổ, huyện Đức Phổ, tỉnh Quảng Ngãi."
LienVietPostBank - PGD Hùng Vương,"Số 28 đường Hùng Vương, phường Nguyễn Nghiêm, TP. Quảng Ngãi, tỉnh Quảng Ngãi."
LienVietPostBank - CN Dung Quất,"Số 1 An Dương Vương, phường Lê Hồng Phong, TP. Quảng Ngãi, tỉnh Quảng Ngãi."
LienVietPostBank - PGD Ba Chẽ,"Số 184, đường Hải Chi, khu 3, thị trấn Ba Chẽ, huyện Ba Chẽ, tỉnh Quảng Ninh"
LienVietPostBank - PGD Bình Liêu,"Số 14, đường Hoàng Cần, thị trấn Bình Liêu, huyện Bình Liêu, tỉnh Quảng Ninh"
LienVietPostBank - PGD Hoành Bồ,"Số 130, tổ 4 khu 4, thị Trấn Trới, huyện Hoành Bồ, tỉnh Quảng Ninh"
LienVietPostBank - PGD Hải Hà,"Số 12 Chu Văn An, thị trấn Quảng Hà, huyện Hải Hà, tỉnh Quảng Ninh"
LienVietPostBank - PGD Tiên Yên,"Số 64 - 66, phố Đồng Tiến 1, thị trấn Tiên Yên, huyện Tiên Yên, tỉnh Quảng Ninh"
LienVietPostBank - PGD Vân Đồn,"Số 80 Tổ 1, khu 4, thị trấn Cái Răng, huyện Vân Đồn, tỉnh Quảng Ninh"
LienVietPostBank - PGD Đông Triều,"Số 1, đường Lê Hồng Phong, phường Đông Triều, thị xã Đông Triều, tỉnh Quảng Ninh"
LienVietPostBank - CN Quảng Ninh,"Số 36a, tổ 10, khu 1, đường Trần Hưng Đạo, phường Trần Hưng Đạo, TP. Hạ Long, tỉnh Quảng Ninh."
LienVietPostBank - PGD Cẩm Phả,"Số 375 đường Trần Phú, phường Cẩm Thành, thành phố Cẩm Phả, tỉnh Quảng Ninh"
LienVietPostBank - PGD Uông Bí,"Số 447, đường Quang Trung, phường Quang Trung, thành phố Uông Bí, tỉnh Quảng Ninh"
LienVietPostBank - PGD Quảng Yên,"Số 54, đường Trần Nhân Tông, khu phố 9, phường Quảng Yên, thị xã Quảng Yên, tỉnh Quảng Ninh"
LienVietPostBank - PGD Cam Lộ,"Số 265, đường 2/4, thị Trấn Cam Lộ, huyện Cam Lộ, tỉnh Quảng Trị"
LienVietPostBank - PGD Gio Linh,"Số 280, đường Lê Duẩn, thị Trấn Gio Linh, huyện Gio Linh, tỉnh Quảng Trị"
LienVietPostBank - PGD Hướng Hóa,"Số 136, đường Lê Duẩn, thị trấn Khe Sanh, huyện Hướng Hóa, tỉnh Quảng Trị"
LienVietPostBank - PGD Hải Lăng,"Số 08, đường Hùng Vương, khóm 5, thị Trấn Hải Lăng, huyện Hải Lăng, tỉnh Quảng Trị"
LienVietPostBank - PGD Triệu Phong,"Số 248, đường Lê Duẩn, thị Trấn Ái Từ, huyện Triệu Phong, tỉnh Quảng Trị"
LienVietPostBank - PGD Vĩnh Linh,"Số 02, đường Hùng Vương, thị Trấn Hồ Xá, huyện Vĩnh Linh, tỉnh Quảng Trị"
LienVietPostBank - PGD ĐaKrông,"Khóm 1, thị trấn Krông Klang, huyện ĐaKrông, tỉnh Quảng Trị"
LienVietPostBank - CN Quảng Trị,"Số 72 quốc lộ 9, phường 1, thành phố Đông Hà, tỉnh Quảng Trị"
LienVietPostBank - PGD Thuận Hòa,"Số 69 quốc lộ 1A, ấp Xây Đá, thị trấn Châu Thành, huyện Châu Thành, tỉnh Sóc Trăng"
LienVietPostBank - PGD Cù Lao Dung,"Ấp Phước Hòa B, Thị trấn Cù Lao Dung, Huyện Cù Lao Dung."
LienVietPostBank - PGD Kế Sách,"Số 93, đường 30/4, ấp An Ninh 1, thị trấn Kế Sách, huyện Kế Sách, tỉnh Sóc Trăng"
LienVietPostBank - PGD Long Phú,"Ấp 4, đường Đoàn Thế Trung, thị trấn Long Phú, huyện Long Phú, tỉnh Sóc Trằng"
LienVietPostBank - PGD Mỹ Tú,"Số 153 Hùng Vương, ấp Cầu Đồn, thị trấn Huỳnh Hữu Nghĩa, huyện Mỹ Tú, tỉnh Sóc Trăng"
LienVietPostBank - PGD Thạnh Phú,"Ấp Châu Thành, Thị trấn Mỹ Xuyên, huyện Mỹ Xuyên"
LienVietPostBank - PGD Thạnh Trị,"Quốc lộ 1A, ấp 2, thị trấn Phú Lộc, huyện Thạnh Trị"
LienVietPostBank - PGD TP. Sóc Trăng,"Số 1 đường Trần Hưng Đạo, phường 3, TP. Sóc Trăng."
LienVietPostBank - CN Sóc Trăng,"Số 113 đường Hùng Vương, Phường 6, TP. Sóc Trăng, tỉnh Sóc Trăng."
LienVietPostBank - CN Sơn La,"Số 162 đường Trường Chinh, tổ 3, phường Quyết Thắng, thành phố Sơn La, tỉnh Sơn La"
LienVietPostBank - PGD Hậu Lộc,"Số 66, quốc lộ 10, khu 4, thị trấn Hậu Lộc, huyện Hậu Lộc, tỉnh Thanh Hóa."
LienVietPostBank - PGD Ngọc Lặc,"878 Phố Cống, thị trấn Ngọc Lặc, huyện Ngọc Lặc, tỉnh Thanh Hoá"
LienVietPostBank - PGD Nông Cống,"Tiểu khu Minh Tân, thị trấn Nông Cống, huyện Nông Cống, tỉnh Thanh Hóa"
LienVietPostBank - PGD Quan Hóa,"Khu 1, thị trấn Quan Hóa, huyện Quan Hóa, tỉnh Thanh Hóa"
LienVietPostBank - PGD Vĩnh Lộc,"Khu 3, thị trấn Vĩnh Lộc, huyện Vĩnh Lộc, tỉnh Thanh Hóa"
LienVietPostBank - CN Thanh Hóa,"Số 33 Trần Phú, phường Điện Biên, TP. Thanh Hóa, tỉnh Thanh Hóa."
LienVietPostBank - PGD Nghi Sơn,"Tiểu khu 6, thị trấn Tĩnh Gia, huyện Tĩnh Gia, tỉnh Thanh Hóa."
LienVietPostBank - PGD Hưng Hà,"Thôn Thị An, thị trấn Hưng Nhân, huyện Hưng Hà, tỉnh Thái Bình"
LienVietPostBank - PGD Kiến Xương,"Khu Cộng Hòa, thị Trấn Thanh Nê, huyện Kiến Xương, tỉnh Thái Bình"
LienVietPostBank - PGD Thái Thụy,"Khu 6, thị trấn Diêm Điền, huyện Thái Thụy, tỉnh Thái Bình"
LienVietPostBank - PGD Tiền Hải,"Phố Tiểu Hoàng, thị trấn Tiền Hải, huyện Tiền Hải, tỉnh Thái Bình"
LienVietPostBank - PGD Vũ Thư,"Khu Minh Tân 1, thị Trấn Vũ Thư, huyện Vũ Thư, tỉnh thái Bình"
LienVietPostBank - PGD Đông Hưng,"Tổ 8, đường Nguyễn Văn Năng, thị trấn Đông Hưng, huyện Đông Hưng, tỉnh Thái Bình."
LienVietPostBank - CN Thái Bình,"Số 07 phố Lê Lợi, phường Lê Hồng Phong, thành phố Thái Bình, tỉnh Thái Bình"
LienVietPostBank - PGD Phú Bình,"Tổ 2, thị trấn Hương Sơn, huyện Phú Bình, tỉnh Thái Nguyên"
LienVietPostBank - PGD Phổ Yên,"Số nhà 569, tổ dân phố 4, phường Ba Hàng, thị xã Phổ Yên, tỉnh Thái Nguyên"
LienVietPostBank - PGD Võ Nhai,"Số 169, phố Thái Long, thị trấn Đình Cả, huyện Võ Nhai, tỉnh Thái Nguyên"
LienVietPostBank - PGD Định Hóa,"Số nhà 463, xóm Bãi Á 1, thị trấn Chợ Chu, huyện Định Hóa, tỉnh Thái Nguyên"
LienVietPostBank - PGD Phú Lương,"Tiểu khu An Thái, thị trấn Đu, huyện Phú Lương, tỉnh Thái Nguyên"
LienVietPostBank - CN Thái Nguyên,"Số 10 đường Cách mạng Tháng Tám, phường Phan Đình Phùng, thành phố Thái Nguyên, tỉnh Thái Nguyên."
