Chi nhánh/Phòng giao dịch,Địa chỉ
OceanBank - OCEANBANK Nam Kỳ Khởi Nghĩa,"Số 935 Hương Lộ 2, ấp Tây, xã Hòa Long, Thành phố Bà Rịa, tỉnh Bà Rịa - Vũng Tàu"
OceanBank - OCEANBANK Vũng Tàu,"Số 29 Trần Hưng Đạo, Phường 1, TP Vũng Tàu, tỉnh Bà Rịa - Vũng Tàu"
OceanBank - OCEANBANK Nguyễn Thái Học,"08-G3 Nguyễn Thái Học, phường 7, TP Vũng Tàu"
OceanBank - OCEANBANK Rạch Dừa,"Số 278 đường 30/4, phường Rạch Dừa, thành phố Vũng Tàu, tỉnh Bà Rịa Vũng Tàu"
OceanBank - OCEANBANK Việt Yên,"Số 221 Thân Nhân Trung, thị trấn Bích Động, huyện Việt Yên, Tỉnh Bắc Giang"
OceanBank - OCEANBANK Bắc Giang,"Số 151, đường Hùng Vương, thành phố Bắc Giang, tỉnh Bắc Giang"
OceanBank - OCEANBANK Cà Mau,"Số 7, đường Đề Thám, Phường 2, Tp. Cà Mau"
OceanBank - OCEANBANK Nguyễn Trường Tộ,"Số: 15 Nguyễn Trường Tộ, P. Nguyễn Trung Trực, Q. Ba Đình, Hà Nội"
OceanBank - OCEANBANK Đào Tấn,"Tầng 1 Daeha, Số 360 Kim Mã, Ba Đình, Hà Nội"
OceanBank - OCEANBANK Ba Đình,"Số 33, Phan Đình Phùng, Ba Đình, Tp.Hà Nộ"
OceanBank - OCEANBANK Giang Văn Minh,"Số 83, Giang Văn Minh, Ba Đình, Hà Nội"
OceanBank - OCEANBANK Thăng Long,"Tầng 1 Tòa nhà Trung Yên Plaza, Khu đô thị Trung Yên,P.Trung Hòa, Q. Cầu Giấy, TP. Hà Nội"
OceanBank - OCEANBANK Hoàng Quốc Việt,"135 Hoàng Quốc Việt, Cầu Giấy, Hà Nội"
OceanBank - OCEANBANK Lạc Long Quân,235 Lạc Long Quân - Phường Nghĩa Đô - Quận Cầu Giấy - Hà Nội
OceanBank - OCEANBANK Trung Yên,"Nhà số: 55 T6TT Sư đoàn 361, tổ 44A phường Yên Hòa, Cầu Giấy, Hà Nội"
OceanBank - OCEANBANK Minh Khai,"308D, Minh Khai, Hai Bà Trưng, Hà Nội"
OceanBank - OCEANBANK Bạch Mai,"277 Bạch Mai, Hai Bà Trưng, Hà Nội"
OceanBank - OCEANBANK Hai Bà Trưng,"Số 71 Lò Đúc, Phường Phạm Đình Hổ, Quận Hai Bà Trưng, Hà Nội"
OceanBank - OCEANBANK Trần Xuân Soạn,"70 Trần Xuân Soạn, Q. Hai Bà Trưng, TP. Hà Nội"
OceanBank - OCEANBANK Thái Phiên,"Số 23 Thái Phiên, phường Lê Đại Hành, quận Hai Bà Trưng, thành phố Hà Nội"
OceanBank - OCEANBANK Lạc Trung,"23 Lạc Trung, Vĩnh Tuy, Hai Bà Trưng, Hà Nội"
OceanBank - OCEANBANK Nguyễn Siêu,"Số 54 Nguyễn Siêu, phường Hàng Buồm, quận Hoàn Kiếm, TP Hà Nội"
OceanBank - OCEANBANK Hoàn Kiếm,"Tháp Hà Nội,49 Hai Bà Trưng, Hoàn Kiếm, Hà Nội"
OceanBank - OCEANBANK Hà Nội,"Tầng 1, tầng 2, tầng 4 tòa nhà Sông Hồng, số 02 Trần Hưng Đạo, phường Phan Chu Trinh, thành phố Hà Nội"
OceanBank - OCEANBANK Trương Định,"339 Trương Định, phường Tương Mai, quận Hoàng Mai, Hà Nội"
OceanBank - OCEANBANK Nguyễn Văn Lộc,"Số 11 Nguyễn Văn Lộc, tổ dân phố 3, phường Mộ Lao, quận Hà Đông, thành phố Hà N"
OceanBank - OCEANBANK Hà Đông,"415, Quang Trung, Hà Đông, Hà Nội"
OceanBank - OCEABANK Long Biên,"Số 73 Nguyễn Sơn, Ngọc Lâm, Long Biên, Hà Nội"
OceanBank - OCEANBANK Mỹ Đình,"B1-09 Khu chức năng đô thị thành phố xanh ( Khu Vinhome Gardenia Hàm Nghi), P.Cầu Diễn, Q.Nam Từ Liêm, TP.Hà Nội"
OceanBank - OCEANBANK Lê Trọng Tấn,"Tầng Lửng và tầng 2, Tòa nhà số 252 Lê Trọng Tấn, phường Khương Mai, quận Thanh Xuân, Hà Nội"
OceanBank - OCEANBANK Tây Hồ,"14 Yên Phụ, Tây Hồ, Hà Nội"
OceanBank - OCEANBANK Âu Cơ,"33, Âu Cơ, Phường Quảng An, Quận Tây Hồ"
OceanBank - OCEANBANK Đống Đa,"120M2 Huỳnh Thúc Kháng, Đống Đa, Hà Nội"
OceanBank - OCEANBANK Nguyễn Lương Bằng,"Số 55 Nguyễn Lương Bằng, P. Nam Đồng, Q. Đống Đa, TP. Hà Nội."
OceanBank - OCEANBANK Quốc Tử Giám,"Số 16 Nguyễn Như Đổ, phường Văn Miếu, Quận Đống Đa, Thành phố Hà Nội và số 30D Ngô Sỹ Liên, phường Văn Miếu, Q.Đống Đa, Hà Nội"
OceanBank - OCEANBANK Hà Tĩnh,"Tòa nhà BMC, Số 2 Phan Đình Phùng, phường Nam Hà, TP Hà Tĩnh, tỉnh Hà Tĩnh"
OceanBank - OCEANBANK Bình Giang,"58A Đại lộ Hùng vương, xã Tráng Liệt, huyện Bình Giang, Hải Dương"
OceanBank - OCEANBANK Gia Lộc,"345 Nguyễn Chế Nghĩa, Thị trấn Gia Lộc, huyện Gia Lộc, Tỉnh Hải Dương"
OceanBank - OCEANBANK Ninh Giang,"Số 93, Khu 6, đường Khúc Thừa Dụ, huyện Ninh Giang, Tỉnh Hải Dương"
OceanBank - OCEANBANK Thanh Hà,"thôn Xuân An, xã Thanh Khê, huyện Thanh Hà, tỉnh Hải Dương"
OceanBank - OCEANBANK Thanh Miện,"Số 26 Lê Bình, khu 4, thị trấn Thanh Miện, huyện Thanh Miện, tỉnh Hải Dương"
OceanBank - OCEANBANK Tứ Kỳ,"Tầng 1, Trung tâm Viễn thông Tứ Kỳ, huyện Tứ Kỳ, Tỉnh Hải Dương"
OceanBank - OCEANBANK Hải Dương,"199 Nguyễn Lương Bằng, Tp Hải Dương"
OceanBank - OCEANBANK Trần Phú,"102 Trần Phú, Tp Hải Dương"
OceanBank - OCEANBANK Quang Trung,"51 Quang Trung, Tp Hải Dương"
OceanBank - OCEANBANK Phạm Ngũ Lão,"Số: 01 Phạm Ngũ Lão, Tp. Hải Dương, T. Hải Dương"
OceanBank - OCEANBANK Nguyễn Trãi,"Số 2 Hoàng Hoa Thám, Phường Nguyễn Trãi, Tp. Hải Dương"
OceanBank - OCEANBANK Chí Linh,"132, Nguyễn Trãi I , Phường Sao Đỏ, thị xã Chí Linh, Tỉnh Hải Dương"
OceanBank - OCEANBANK Cẩm Phả,"Số 16, Đường Tô Hiệu, Phường Cẩm Trung, TP Cẩm Phả, Quảng Ninh."
OceanBank - OCEANBANK Uông Bí,"Số 515, Tổ 43, Khu 12, phường Quang Trung, Thành phố Uông Bí, Tỉnh Quảng Ninh"
OceanBank - OCEANBANK Hoàng Hoa Thám,"Số 31, Hoàng Hoa Thám, P.6, Quận Bình Thạnh, Tp.HCM"
OceanBank - OCEANBANK Sài Gòn,"Số 297- 299- 299A đường Phạm Ngũ Lão, phường Phạm Ngũ Lão, Quận 1, TP HCM"
OceanBank - OCEANBANK Lê Duẩn,"1-5 Lê Duẩn, Phường Bến Nghé, Quận 1, TP.HCM"
OceanBank - OCEANBANK Trần Não,"Tầng 1 và Tầng 2 tòa nhà 171 đường Trần Não, phường Bình An, Quận 2, TP.HCM"
OceanBank - OCEANBANK Thành phố Hồ Chí Minh,"Số 47 Bà Huyện Thanh Quan, Phường 6, Quận 3, TP Hồ Chí Minh"
OceanBank - OCEANBANK Quận 5,"Số 458 An Dương Vương, Phường 4, Quận 5, TP HCM"
OceanBank - OCEANBANK Phú Mỹ Hưng,"Lô C6A-01 Tân Trào, phường Tân Phú, quận 7, thành phố Hồ Chí Minh"
OceanBank - OCEANBANK Quận 7,"47-49 Nguyễn Thị Thập, Khu đô thị mới Him Lam, phường Tân Hưng, Quận 7, Tp. Hồ Chí Minh"
OceanBank - OCEANBANK Tân Phú,"Số 800 Âu Cơ, phường 14, quận Tân Bình, thành phố Hồ Chí Minh"
OceanBank - OCEANBANK Đà Nẵng,"Số BH02-06, khu đô thị Vinhomes Imperia Hải Phòng, quận Hồng Bàng, TP Hải Phòng"
OceanBank - OCEANBANK Hải Phòng,"Số 418-418A-420 đường Tô Hiệu, phường Trần Nguyên Hãn, Quận Lê Chân"
ABBank - PGD Phước Tỉnh,"Số nhà 73, tổ 4, Lò Vôi, Xã Phước Hưng, Huyện Long Điền, Tỉnh Bà Rịa-Vũng Tàu"
ABBank - PGD Bà Rịa,"Số 257 Cách Mạng Tháng Tám, Phường Phước Hiệp, TP. Bà Rịa, Tỉnh Bà Rịa-Vũng Tàu"
ABBank - PGD Ba Mươi Tháng Tư,"Số 02 đường Nguyễn Hữu Cảnh, P. Thắng Nhất, Tp. Vũng Tàu, Tỉnh Bà Rịa, Vũng Tàu"
ABBank - PGD Vũng Tàu,"370 Đường Lê Hồng Phong, Phường 3, Thành Phố Vũng Tàu, Tỉnh Bà Rịa - Vũng Tàu"
ABBank - PGD Đào Tấn,"99 Đào Tấn, Phường Ngọc Khánh, Quận Ba Đình, TP. Hà Nội"
ABBank - PGD Đội Cấn,"279A Đội Cấn, Ba Đình, Hà Nội"
ABBank - PGD Quán Thánh,"132 Phố Quán Thánh, Phường Quán Thánh, Ba Đình, Hà Nội"
ABBank - PGD Nam Thăng Long,"Tầng 1 Tòa nhà A3, Dự án thành phần khu nhà ở cao tầng CT2 thuộc khu đô thị thành phố Giao lưu số 232 Phạm Văn Đồng, Phường Cổ Nhuế 1, Quận Bắc Từ Liêm, TP. Hà Nội"
ABBank - PGD Hoàng Quốc Việt,"141 Hoàng Quốc Việt, Phường Nghĩa Đô, Quận Cầu Giấy, Hà Nội"
ABBank - PGD Trần Đăng Ninh,"109 Trần Đăng Ninh, Q. Cầu Giấy, Hà Nội"
ABBank - PGD Trung Yên,"Số 3, Lô 2B, Khu Đô thị Trung Yên, Phường Yên Hòa, Quận Cầu Giấy, Hà Nội"
ABBank - PGD Tây Hồ,"Số 387 Lạc Long Quân, Quận Cầu Giấy, Hà Nội"
ABBank - PGD Trần Khát Chân,"366 Trần Khát Chân, Phường Thanh Nhàn, Quận Hai Bà Trưng, TP. Hà Nội"
ABBank - PGD Lò Đúc,"126 Lò Đúc, Phường Đông Mác, Quận Hai Bà Trưng, Hà Nội"
ABBank - PGD Phố Huế,"Số 129 Bùi Thị Xuân,Phường Bùi Thị Xuân, Quận Hai Bà Trưng, Hà Nội"
ABBank - PGD Tràng Tiền,"Số 6 Hàng Bài, Phường Tràng Tiền, Quận Hoàn Kiếm, Hà Nội"
ABBank - PGD Cửa Nam,"Số 28 Cửa Nam, Phường Cửa Nam, Quận Hoàn Kiếm, Thành phố Hà Nội"
ABBank - PGD Hồ Gươm,"30 Lý Thái Tổ, Phường Lý Thái Tổ, Quận Hoàn kiếm, TP. Hà Nội"
ABBank - PGD Đại Kim,"A5, Khu C8 Khu Đô thị mới Đại Kim, Định Công, Hoàng Mai, Hà Nội"
ABBank - PGD Quang Trung - Hà Đông,"353 Quang Trung, Phường Quang Trung, Quận Hà Đông, Hà Nội"
ABBank - PGD Hà Đông,"1 Trần Phú, Quận Hà Đông, TP. Hà Nội"
ABBank - PGD Ngô Gia Tự,"86 Ngô Gia Tự, Phường Đức Giang, Quận Long Biên, TP. Hà Nội"
ABBank - PGD Nguyễn Văn Cừ,"453 Nguyễn Văn Cừ, Q. Long Biên, Hà Nội"
ABBank - PGD Hồ Tùng Mậu,"Tầng 1 – Chung cư C4 – KĐT Mỹ ĐÌnh 1 – Số 44 Phố Nguyễn Cơ Thạch, Phường Cầu Diễn, Quận Nam Từ Liêm- TP Hà Nội"
ABBank - PGD Giải Phóng,"441 Giải Phóng, Phường Phương Liệt, Quận Thanh Xuân, Hà Nội"
ABBank - PGD Lê Trọng Tấn,"262 Lê Trọng Tấn, Phường Khương Mai, Quận Thanh Xuân, TP. Hà Nội"
ABBank - QTK Dục Tú,"Km3, Quốc lộ 3, Đồng Dầu, Khu T1-T2 Dục Tú, Huyện Đông Anh, TP. Hà Nội"
ABBank - PGD Bắc Thăng Long,"Tòa nhà 9 tầng - Khu vực chợ Cổ Điển, Hải Bối, Đông Anh, Hà Nội"
ABBank - PGD Đông Anh,"01 Cao Lỗ, Thôn Phan Xá, Xã Uy Nỗ, Huyện Đông Anh, Hà Nội"
ABBank - PGD Hoàng Cầu,"36 Hoàng Cầu, Phường Ô Chợ Dừa, Quận Đống Đa, Hà Nội"
ABBank - PGD Đống Đa,"Số 64 Nguyễn Lương Bằng, Phường Nam Đồng, Quận Đống Đa, Thành phố Hà Nội"
ABBank - CN Hà Nội,"101 Láng Hạ, Quận Đống Đa, Hà Nội"
ABBank - PGD Khoái Châu,"Thôn Yên Lịch, Xã Dân Tiến, Huyện Khoái Châu, Tỉnh Hưng Yên"
ABBank - CN Hưng Yên,"Trung tâm văn hóa thể thao Gia Phong, ngã tư thị trấn Bần Yên Nhân, huyện Mỹ Hào, tỉnh Hưng Yên"
ABBank - PGD Phố Hiến,"Số 6 Nguyễn Thiện Thuật, Thành phố Hưng Yên, Tỉnh Hưng Yên"
ABBank - PGD Văn Lâm,"Thôn Nhạc Lộc, Xã Trưng Trắc, Huyện Văn Lâm, Tỉnh Hưng Yên"
ABBank - CN Khánh Hòa,"22 Thái Nguyên, Phường Phương Sài, TP.Nha Trang, Tỉnh Khánh Hoà"
ABBank - CN Kiên Giang,"40 Trần Phú, Phường Vĩnh Thanh, TP. Rạch Giá, Kiên Giang"
ABBank - PGD Mộc Châu,"688 Tiểu Khu 6, Thị trấn Mộc Châu, Huyện Mộc Châu, Tỉnh Sơn La"
ABBank - PGD Quyết Thắng,"Số 98, Đường 3/2, Tổ 08, Phường Quyết Thắng, Thành phố Sơn La, Tỉnh Sơn La"
ABBank - PGD Đông Ba,"209 Trần Hưng Đạo, Phường Phú Hoà, Tỉnh Thừa Thiên Huế"
ABBank - CN Thừa Thiên Huế,"26 Hà Nội, Phường Phú Nhuận, Thành phố Huế, Tỉnh Thừa Thiên Huế"
ABBank - PGD Nguyễn Huệ,"100 Nguyễn Huệ, Phường Vĩnh Ninh, TP. Huế, Tỉnh Thừa Thiên Huế"
ABBank - PGD Phú Bài,"Số 1006 Nguyễn Tất Thành, Tổ 11, Phường Phú Bài, Thị xã Hương Thủy, Tỉnh Thừa Thiên Huế"
ABBank - PGD Ô Môn,"03 QL 91, KV 4, Phường Châu Văn Liêm, Quận Ô Môn, TP. Cần Thơ"
ABBank - PGD Bình Tân,"472 Kinh Dương Vương, Q. Bình Tân , Tp. Hồ Chí Minh"
ABBank - PGD Quang Trung,"187 - 189 Phan Đăng Lưu, Phường 1, Quận Phú Nhuận, TP.Hồ Chí Minh"
ABBank - Chi nhánh TP. Hồ Chí Minh,"170 Hai Bà Trưng, Phường Đa Kao, Quận 1, TP Hồ Chí Minh"
ABBank - PGD ĐaKao,"47 Điện Biên Phủ, Quận 1, Tp. Hồ Chí Minh."
ABBank - PGD Tao Đàn,"168 Bùi Thị Xuân, Phường Phạm Ngũ Lão, Quận 1, TP.HCM"
ABBank - PGD Trung tâm SME,"Tầng trệt, Tòa nhà Green Power, số 35 Tôn Đức Thắng, Phường Bến Nghé, Quận 1, TP. Hồ Chí Minh"
ABBank - PGD Chợ Lớn,"110 Nguyễn Chí Thanh, Quận 10, TP.HCM"
ABBank - PGD Kỳ Hòa,"Tầng trệt, tòa nhà Khu công nghệ Thái Sơn, số 03 đường 3/2, Phường 11, Quận 10, TP.HCM"
ABBank - PGD Tô Hiến Thành,"287 Tô Hiến Thành, Phường 13, Quận 10, TP. Hồ Chí Minh"
ABBank - PGD Phó Cơ Điều,"1147-1149-1151 Đường 3/2, Phường 6, Quận 11, TP. Hồ Chí Minh"
ABBank - PGD Bình Thới,"85A Bình Thới, Phường 11, Quận 11, TP.HCM"
ABBank - PGD Hậu Giang,"243 Hậu Giang, Phường 5, Quận 6, Tp. Hồ Chí Minh"
ABBank - PGD Trung Chánh,"356A Nguyễn Ảnh Thủ, P Trung Mỹ Tây, Quận 12, Tp.Hồ Chí Minh"
ABBank - PGD Đông Bến Thành,"172 Trần Não, Phường Bình An, Quận 2, TP. Hồ Chí Minh"
ABBank - PGD Minh Khai,"126 Nguyễn Thị Minh Khai, Phường 6, Quận 3, Tp. Hồ Chí Minh"
ABBank - PGD Bàn Cờ,"Một phần căn nhà số 532-534 đường Nguyễn Đình Chiểu, Phường 4, Quận 3, TP.HCM"
ABBank - PGD Khánh Hội,"184 – 186 Khánh Hội, Phường 6, Quận 4, TP. Hồ Chí Minh"
ABBank - CN Sài Gòn,"855 Trần Hưng Đạo, Phường 1, Quận 5, Tp.Hồ Chí Minh."
ABBank - PGD Phú Mỹ Hưng,"1441 Mỹ Toàn 2, Nguyễn Văn Linh, P. Tân Phong, Quận 7, Tp. Hồ Chí Minh."
ABBank - PGD Tân Thuận,"Số 350 Nguyễn Thị Thập, Phường Tân Quy, Quận 7, TP Hồ Chí Minh"
ABBank - PGD Chánh Hưng,"Số 320 bis Chánh Hưng, P.5, Q.8, TP.HCM"
ABBank - PGD Lê Văn Việt,"77 Lê Văn Việt, Phường Hiệp Phú, Quận 9, TP. Hồ Chí Minh"
ABBank - PGD Dân Chủ,"115 Dân Chủ, P.Bình Thọ, Q.Thủ Đức, Tp.Hồ Chí Minh."
ABBank - PGD Nguyễn Văn Trỗi,"428-430-432 Hoàng Văn Thụ, Phường 4, Quận Tân Bình, TP.Hồ Chí Minh"
ABBank - PGD Trường Chinh,"499 Trường Chinh, P.14, Q.Tân Bình, TP.HCM"
ABBank - PGD Cộng Hòa,"78 Cộng Hoà, Phường 4, Quận Tân Bình, Tp. Hồ Chí Minh"
ABBank - PGD Lũy Bán Bích,"283 Lũy Bán Bích, P. Hiệp Tân, Quận Tân Phú, Tp.HCM"
ABBank - PGD Tân Phú,"328B Nguyễn Sơn, Phường Phú Thọ Hòa, Quận Tân Phú, Hồ Chí Minh"
ABBank - CN Hải Phòng,"09 Trần Hưng Đạo, Phường Hoàng Văn Thụ, Quận Hồng Bàng, Tp. Hải Phòng"
ABBank - PGD Lạch Tray,"Số 125A Tô Hiệu, Phường Trại Cau, Quận Lê Chân, TP. Hải Phòng"
ABBank - PGD Trần Nguyên Hãn,"263K-263L Trần Nguyên Hãn, Quận Lê Chân, Thành Phố Hải Phòng"
ABBank - PGD Ngô Quyền,"Số 1 Phạm Minh Đức, phường Máy Tơ, Quận Ngô Quyền, TP. Hải Phòng"
ABBank - PGD Hùng Vương,"195 Hùng Vương, Quận Hải Châu, TP. Đà Nẵng"
ABBank - PGD Nguyễn Chí Thanh,"179 Nguyễn Chí Thanh, Phường Hải Châu 1, Quận Hải Châu, TP. Đà Nẵng"
ABBank - CN Đà Nẵng,"Số 255, đường Lê Duẩn, Phường Tân Chính, Quận Thanh Khê, TP. Đà Nẵng"
ABBank - PGD Nguyễn Văn Linh,"167 Nguyễn Văn Linh, Phường Thạc Gián, Quận Thanh Khê, TP. Đà Nẵng"
ABBank - CN Điện Biên,"Tổ dân phố 09, đường Võ Nguyên Giáp, Phường Tân Thanh, Thành phố Điện Biên Phủ, Tỉnh Điện Biên"
ACB - PGD Thành Nam,"38-40 THÀNH CHUNG, PHƯỜNG BÀ TRIỆU, THÀNH PHỐ NAM ĐỊNH"
ACB - CN Nam Định,"67 Lê Hồng Phong, P. Nguyễn Du, Thanh pho Nam Dinh, Nam Dinh"
ACB - PGD Châu Đốc,"46, Quang Trung, P. Châu Phú B, TP Châu Đốc"
ACB - PGD Long Xuyên,"95 Nguyễn Trãi, P. Mỹ Long, Thanh pho Long Xuyen, An Giang"
ACB - PGD Bình Khánh,"582/30 Trần Hưng Đạo, P. Bình Khánh, Thanh pho Long Xuyen, An Giang"
ACB - CN An Giang,"9 Trần Hưng Đạo, P. Mỹ Xuyên, Thanh pho Long Xuyen, An Giang"
ACB - PGD Tân Châu,"85 Nguyễn Văn Cừ, P. Long Thạnh, Huyen Tan Chau, An Giang"
ACB - PGD Long Điền,"số 5 tổ 9, ấp Phước Lâm, Huyen Long Dien, Ba Ria-VT"
ACB - PGD Bà Rịa,"265 CMT8, P. Phước Hiệp, Thi xa Ba Ria, Ba Ria-VT"
ACB - PGD TTTM Vũng Tàu,"413 - 415 Nguyễn An Ninh, Thanh pho Vung Tau, Ba Ria-VT"
ACB - PGD Lê Hồng Phong,"328 Lê Hồng Phong, P.3, Thanh pho Vung Tau, Ba Ria-VT"
ACB - PGD Nguyễn An Ninh,"89 Nguyễn An Ninh, P.6, Thanh pho Vung Tau, Ba Ria-VT"
ACB - CN Vũng Tàu,"Lô A3 - A8, 111 Hoàng Hoa Thám, P. 2, Thanh pho Vung Tau, Ba Ria-VT"
ACB - PGD Rạch Dừa,"306 đường 30/4, P. Rạch Dừa, Thanh pho Vung Tau, Ba Ria-VT"
ACB - PGD Tân Thành,"Số 1820, tờ bản đồ số 10, Huyen Tan Thanh, Ba Ria-VT"
ACB - PGD Bến Cát,"Khu 2 Đường 30/4, Thị trấn Mỹ Phước, Huyen Ben Cat, Binh Duong"
ACB - PGD KCN Sóng Thần,"3/31-4/31 Đại lộ Độc Lập, TT. Dĩ An, Huyen Thuan An, Binh Duong"
ACB - Phòng giao dịch Lái Thiêu,"188A đường ĐT 745, Khu phố Bình Đức 1, P.Lái Thiêu, TX Thuận An, Bình Dương"
ACB - PGD Dĩ An,"39 – 41 Nguyễn An Ninh, Khu Trung tâm Hành Chính, Khu phố Nhị Đồng 2, Phường Dĩ An, Thị xã Dĩ An, Tỉnh Bình Dương"
ACB - PGD Thủ Dầu Một,"67 Hùng Vương, P. Phú Cường, Thi xa Thu Dau Mot, Binh Duong"
ACB - CN Bình Dương,"305 ĐL Bình Dương, Thi xa Thu Dau Mot, Binh Duong"
ACB - PGD Chợ Đình,"Khu 1, P. Phú Hòa, Thi xa Thu Dau Mot, Binh Duong"
ACB - PGD Bình Long,"134-136-138 NGUYỄN HUỆ, KHU PHỐ PHÚ NGHĨA, PHƯỜNG PHÚ ĐỨC, THỊ XÃ BÌNH LONG, BÌNH PHƯỚC"
ACB - PGD Chơn Thành,"Số 8 QL 13, tổ 2, Khu phố 4, TT. Chơn Thành, Huyen Chon Thanh, Binh Phuoc"
ACB - PGD Lộc Ninh,"272 QL 13, Khu phố Ninh Thịnh, TT. Lộc Ninh, Huyen Loc Ninh, Binh Phuoc"
ACB - PGD Phước Long - Bình Phước,"Số 21 đường ĐT 741, P. Long Phước, Huyen Phuoc Long, Binh Phuoc"
ACB - CN Bình Phước,"Lô 19 – 20 Phú Riềng Đỏ, P. Tân Bình, Thi xa Dong Xoai, Binh Phuoc"
ACB - CN Phan Thiết,"152 Trần Hưng Đạo, P. Phú Thủy, Thanh pho Phan Thiet, Binh Thuan"
ACB PGD Lagi,"18 TRẦN HƯNG ĐẠO, KHU PHỐ 8, PHƯỜNG PHƯỚC HỒ, THỊ XÃ LA GI"
ACB - PGD Bồng Sơn,"196A - 196B Quang Trung, Thị trấn Bồng Sơn, Huyen Hoai Nhon, Binh Dinh"
ACB - PGD Chợ Khu Sáu,"308 Nguyễn Thái học, P.Ngô Mây, TP.Quy Nhơn, T.Bình Định"
ACB - CN Bình Định,"Số 171 - 175 Lê Hồng Phong, P.Lê Hồng Phong, TP Quy Nhơn, Tỉnh Bình Định"
ACB - PGD Quy Nhơn,"Số 171 Trần Hưng Đạo, Phường Lê Lợi, TP.Quy Nhơn, Tỉnh Bình Định"
ACB - CN Bạc Liêu,"20 Trần Phú, P. 3, Thi xa Bac Lieu, Bac Lieu"
ACB - CN Bắc Giang,"SỐ 01 NGUYỄN VĂN CỪ, PHƯỜNG TRẦN PHÚ, TP. BẮC GIANG"
ACB - PGD Kinh Bắc,"202 Ngô Gia Tự, P. Suối Hoa, Thi xa Bac Ninh, Bac Ninh"
ACB - CN Bắc Ninh,"201-203-205 Trần Phú, P, Đông Ngàn, TX Từ Sơn, Tỉnh Bắc Ninh"
ACB - CN Bến Tre,"67C1 ĐL Đồng Khởi, P. Phú Khương, Thi xa Ben Tre, Ben Tre"
ACB - CN Cà Mau,"3A Hùng Vương, Thanh pho Ca Mau, Ca Mau"
ACB - CN Gia Lai,"61 Trần Phú (nối dài), P. Tây Sơn, Thanh pho Pleiku, Gia Lai"
ACB - CN Hà Nam,"54 Đường Biên Hòa, P. Minh Khai, Thi xa Phu Ly, Ha Nam"
ACB - PGD Thành Công,"24, Thành Công, P. Thành Công, Q. Ba Đình, Hà Nội"
ACB - PGD Liễu Giai,"30, Liễu Giai, P. Cống Vị, Q. Ba Đình, Thành phố Hà Nội"
ACB - PGD Giang Văn Minh,"142 Đội Cấn, P. Đội Cấn, Quận Ba Đình, Hà Nội"
ACB - PGD Ngọc Hà,"94, Ngọc Hà, P. Đội Cấn, Q. Ba Đình, Hà Nội"
ACB - PGD Cửa Bắc,"8, Cửa Bắc, P. Trúc Bạch, Q. Ba Đình, Hà Nội"
ACB - PGD Nguyễn Khánh Toàn,"số 96 đường Nguyễn Khánh Toàn, P. Quan Hoa, Q. Cầu Giấy"
ACB - PGD Nguyễn Thị Định,"52, Nguyễn Thị Định, P. Nhân Chính, Q. Thanh Xuân, Hà Nội"
ACB - PGD Trần Duy Hưng,"216 Trần Duy Hưng, P.Trung Hòa, Quan Cau Giay, Ha Noi"
ACB - PGD Xuân Thủy,"139 Xuân Thủy, tổ 19, phường Dịch Vọng, Quận Cầu Giấy, Hà Nội"
ACB - PGD Hồ Tùng Mậu,"1 Lê Đức Thọ, P. Mai Dịch, Quan Cau Giay, Ha Noi"
ACB - CN Hà Thành,"Tầng 2 + 3 tòa nhà Báo sinh viên, khu đô thị mới Cầu Giấy, Đường Trần Thái Tông, phường Yên Hòa, quận Cầu Giấy, Hà Nội"
ACB - PGD Trần Quốc Hoàn,"32 TRẦN QUỐC HOÀN, TỔ 1, PHƯỜNG DỊCH VỌNG HẬU, QUẬN CẦU GIẤY, HÀ NỘI"
ACB - PGD Hoàng Quốc Việt,"365-367, Hoàng Quốc Việt, P. Nghĩa Tân, Q. Cầu Giấy"
ACB - CN Hà Nội,"184-186 Bà Triệu, P. Nguyễn Du, Quan Hai Ba Trung, Ha Noi"
ACB - PGD Minh Khai,"Tầng 1, Tòa nhà chung cư 15T2 số 310 Minh Khai, P.Minh Khai, Q.Hai Bà Trưng, TP.Hà Nội"
ACB - PGD Trần Đại Nghĩa,"Số 74 Trần Đại Nghĩa,Phường Đồng Tâm,Quận Hai Bà Trưng,thành phố Hà Nội"
ACB - PGD Bạch Mai,"329, Bạch Mai, P. Bạch Mai, Q.Hai Bà Trưng"
ACB - PGD Thanh Nhàn,"499, Trần Khát Chân, P. Thanh Nhàn, Q. Hai Bà Trưng"
ACB - PGD Lò Đúc,"166 Lò Đúc, Quan Hai Ba Trung, Ha Noi"
ACB - CN Thăng Long,"10 Phan Chu Trinh, Quan Hoan Kiem, Ha Noi"
ACB - PGD Trần Quốc Toản,"95-97, Trần Quốc Toản, P.Trần Hưng Đạo, Q. Hoàn Kiếm"
ACB - Văn phòng đại diện tại Hà Nội,"10 Phan Chu Trinh, P. Phan Chu Trinh, Quận Hoàn Kiếm, Hà Nội"
ACB - PGD Tràng Thi,"10B, Tràng Thi, Q. Hoàn Kiếm"
ACB - PGD Nguyễn Hữu Huân,"90A, Nguyễn Hữu Huân, P. Lý Thái Tổ, Q. Hoàn Kiếm"
ACB - PGD Bát Đàn,"Tầng 01+ 02+ 03 của căn nhà tại địa chỉ 16A Đường Thành, P.Cửa Đông, Q.Hoàn Kiếm, TP.Hà Nội"
ACB - CN Cửa Nam,"48 Phùng Hưng, P. Hàng Bông, quận Hoàn Kiếm, thành phố Hà Nội"
ACB - PGD Đồng Xuân,"25 Hàng Lược, P.Hàng Mã, Quận Hoàn Kiếm, Hà Nội"
ACB - PGD Định Công,"Lô 25 (CT9), Trung tâm thương mại Định Công, Khu đô thị Định Công, P. Định Công, Q. Hoàng Mai"
ACB - PGD Kim Đồng,"Số 461 Trương Định, P.Tân Mai, Q.Hoàng Mai, TP.Hà Nội"
ACB - PGD Đền Lừ,"70, lô 7 Đền Lừ 2, P. Hoàng Văn Thụ, Hoàng Mai, Hà Nội"
ACB - PGD Tương Mai,"71 Nguyễn An Ninh, P. Tương Mai, Hoàng Mai, Hà Nội"
ACB - PGD Linh Đàm,"Ô9, BT2, Khu nhà ở Bắc Linh Đàm, P. Hoàng Liệt, Q.Hoàng Mai"
ACB - PGD Hà Đông,"Số 30 – 30A Quang Trung, phường Quang Trung, Quận Hà Đông, Thành phố Hà Nội"
ACB - PGD Huỳnh Thúc Kháng,"29, Huỳnh Thúc Kháng, P. Láng Hạ, Q. Đống Đa"
ACB - PGD Văn Quán,"A4 TT10, Khu đô thị Văn Quán, P.Văn Quán, Q.Hà Đông"
ACB - PGD Ngọc Lâm,"398, Nguyễn Văn Cừ, Q. Long Biên, Hà Nội"
ACB - PGD Đức Giang,"TẦNG 1, 285 A NGÔ GIA TỰ, PHƯỜNG ĐỨC GIANG, QUẬN LONG BIÊN, HÀ NỘI"
ACB - PGD Trung Văn,"Tầng 1 và tầng 5, Tòa CT2 – Tòa Nhà Bắc Hà C14 đường Tố Hữu, P.Trung Văn, Q.Nam Từ Liêm, TP. Hà Nội"
ACB - PGD Mỹ Đình,"Tầng 1. tòa nhà The Manor, đường Mễ Trì, P. Mỹ Đình 1, Q. Nam Từ Liêm, Hà Nội"
ACB - PGD Hàm Nghi,"Gian hàng SO03, Chung cư A2 Vinhomes Gardenia, Hàm Nghi, Cầu Diễn, Nam Từ Liêm, Hà Nội"
ACB - PGD Nội Bài,"Khu C, Tầng 1, Nhà ga T1, Sân bay Nội Bài, Huyen Soc Son, Ha Noi"
ACB - PGD Thanh Trì,"Km 10 – 300 Khu chợ, Thị trấn Văn Điển, H. Thanh Trì"
ACB - CN Đông Đô,"Tầng 1 và tầng 2 Tòa nhà Golden Land, số 275 Nguyễn Trãi, phường Thanh Xuân Trung, quận Thanh Xuân, thành phố Hà Nội"
ACB - PGD Thanh Xuân,"104 Khuất Duy Tiến, P. Nhân Chính, Q. Thanh Xuân"
ACB - PGD Hoàng Hoa Thám,"671, Hoàng Hoa Thám, P. Vĩnh Phúc, Q. Ba Đình"
ACB - PGD Âu Cơ,"49, Âu Cơ, P. Quảng An, Q. Tây Hồ"
ACB - PGD Tây Hồ,"Tầng 1 tòa nhà Hancom - 39 Ngõ 603 đường Lạc Long Quân, P.Xuân La, Q.Tây Hồ, Hà Nội"
ACB - PGD Đông Anh,"25 Cao Lỗ, Uy Nỗ, Đông Anh, Hà Nội"
ACB - PGD Láng Thượng,"106, Nguyễn Chí Thanh, P. Láng Thượng, Q. Đống Đa (số cũ: Tổ 20, P. Láng Thượng, Q. Đống Đa)"
ACB - PGD Hoàng Cầu,"Số 85 Phố Hoàng Cầu, P.Ô Chợ Dừa, Q.Đống Đa, Hà Nội"
ACB - PGD Kim Liên,"Tầng 1, số 7 đường Chùa Bộc, P. Quang Trung, Q. Đống Đa, Hà Nội"
ACB - PGD Khâm Thiên,"Số 17 Khâm Thiên, P. Khâm Thiên, Q.Đống Đa, Hà Nội"
ACB - PGD Ô Chợ Dừa,"480 Xã Đàn, P. Nam Đồng, Q.Đống Đa , Hà Nội"
ACB - PGD Giảng Võ,"211, Giảng Võ, P. Cát Linh, Q. Đống Đa"
ACB - PGD Tôn Đức Thắng,"32, Tôn Đức Thắng, Q. Đống Đa"
ACB - PGD Kỳ Anh,"Tổ dân phố 3, phường Sông Trí, thị xã Kỳ Anh, tỉnh Hà Tĩnh."
ACB - CN Hà Tĩnh,"52 Phan Đình Phùng, P. Nam Hà, Thi xa Ha Tinh, Ha Tinh"
ACB - PGD Hồng Lĩnh,"02 Trần Phú, Khối 4, P. Bắc Hồng, Thi xa Hong Linh, Ha Tinh"
ACB - CN Hưng Yên,"Thị Trấn Bần Yên Nhân, Huyen My Hao, Hung Yen"
ACB - PGD Phố Hiến,"279 Đường Điện Biên, P. Quang Trung, Thi xa Hung Yen, Hung Yen"
ACB - PGD Văn Giang,"TẦNG 1+2+3, SỐ 118, ĐƯỜNG 179, THỊ TRẤN VĂN GIANG, HUYỆN VĂN GIANG, TỈNH HƯNG YÊN"
ACB - PGD Văn Lâm,"Phố mới, Thị trấn Như Quỳnh, Huyen Van Lam, Hung Yen"
